"Han, Shuang; Qiao, Yanhui; Yan, Ping; Yan, Jie; Liu, Yongqian; Li, Li; ",Wind turbine power curve modeling based on interval extreme probability density for the integration of renewable energies and electric vehicles,Renewable energy,157.0,,190-203,2020,Elsevier,power curve model,2025-06-12,10.1016/j.renene.2020.04.097,"@article{Han_2020, title={Wind turbine power curve modeling based on interval extreme probability density for the integration of renewable energies and electric vehicles}, volume={157}, ISSN={0960-1481}, url={http://dx.doi.org/10.1016/j.renene.2020.04.097}, DOI={10.1016/j.renene.2020.04.097}, journal={Renewable Energy}, publisher={Elsevier BV}, author={Han, Shuang and Qiao, Yanhui and Yan, Ping and Yan, Jie and Liu, Yongqian and Li, Li}, year={2020}, month=sep, pages={190–203} }",https://doi.org/10.1016/j.renene.2020.04.097,True,True,True,"Ambient Temperature, Air Pressure, Air Density, Blade Pitch Angle","IEC Standard, MLE, ANN, Polynomial regression","RMSE, MAE, Duration",,,,,15 min,12,China,4,2,,,No,No
"Sun, Haiying; Qiu, Changyu; Lu, Lin; Gao, Xiaoxia; Chen, Jian; Yang, Hongxing; ",Wind turbine power modelling and optimization using artificial neural network with wind field experimental data,Applied Energy,280.0,,115880,2020,Elsevier,wind turbine power,2025-06-13,10.1016/j.apenergy.2020.115880,"@article{Sun_2020, title={Wind turbine power modelling and optimization using artificial neural network with wind field experimental data}, volume={280}, ISSN={0306-2619}, url={http://dx.doi.org/10.1016/j.apenergy.2020.115880}, DOI={10.1016/j.apenergy.2020.115880}, journal={Applied Energy}, publisher={Elsevier BV}, author={Sun, Haiying and Qiu, Changyu and Lu, Lin and Gao, Xiaoxia and Chen, Jian and Yang, Hongxing}, year={2020}, month=dec, pages={115880} }",https://doi.org/10.1016/j.apenergy.2020.115880,True,True,True,"Wind Direction, yaw angle",Feed forward NN,"R^2, MSE",,,,,,5,Shiren Wind Farm in northern China,15,1.55,Onshore,,No,No
"Dongre, Bharti; Pateriya, Rajesh K; ",Power curve model classification to estimate wind turbine power output,Wind Engineering,43.0,3.0,213-224,2019,"SAGE Publications Sage UK: London, England",power curve estimation,2025-06-12,10.1177/0309524x18780393,"@article{Dongre_2018, title={Power curve model classification to estimate wind turbine power output}, volume={43}, ISSN={2048-402X}, url={http://dx.doi.org/10.1177/0309524x18780393}, DOI={10.1177/0309524x18780393}, number={3}, journal={Wind Engineering}, publisher={SAGE Publications}, author={Dongre, Bharti and Pateriya, Rajesh K}, year={2018}, month=jun, pages={213–224} }",https://doi.org/10.1177/0309524x18780393,True,True,False,,,None,,,,,,,,,,,,,
"Long, Huan; Sang, Linwei; Wu, Zaijun; Gu, Wei; ",Image-based abnormal data detection and cleaning algorithm via wind power curve,IEEE Transactions on Sustainable Energy,11.0,2.0,938-946,2019,IEEE,wind power curve,2025-06-12,10.1109/tste.2019.2914089,"@article{Long_2020, title={Image-Based Abnormal Data Detection and Cleaning Algorithm via Wind Power Curve}, volume={11}, ISSN={1949-3037}, url={http://dx.doi.org/10.1109/tste.2019.2914089}, DOI={10.1109/tste.2019.2914089}, number={2}, journal={IEEE Transactions on Sustainable Energy}, publisher={Institute of Electrical and Electronics Engineers (IEEE)}, author={Long, Huan and Sang, Linwei and Wu, Zaijun and Gu, Wei}, year={2020}, month=apr, pages={938–946} }",https://doi.org/10.1109/tste.2019.2914089,True,False,True,,,None,,,,,,,,,,,,,
"Wadhvani, Rajesh; Shukla, Sanyam; ",Analysis of parametric and non-parametric regression techniques to model the wind turbine power curve,Wind Engineering,43.0,3.0,225-232,2019,"SAGE Publications Sage UK: London, England",power curve monitoring,2025-06-12,10.1177/0309524x18780398,"@article{Wadhvani_2018, title={Analysis of parametric and non-parametric regression techniques to model the wind turbine power curve}, volume={43}, ISSN={2048-402X}, url={http://dx.doi.org/10.1177/0309524x18780398}, DOI={10.1177/0309524x18780398}, number={3}, journal={Wind Engineering}, publisher={SAGE Publications}, author={Wadhvani, Rajesh and Shukla, Sanyam}, year={2018}, month=jun, pages={225–232} }",https://doi.org/10.1177/0309524x18780398,False,False,False,,,None,,,,,,,,,,,,,
"Pei, Shenglei; Li, Yifen; ",Wind turbine power curve modeling with a hybrid machine learning technique,Applied Sciences,9.0,22.0,4930,2019,MDPI,power curve estimation,2025-06-12,10.3390/app9224930,"@article{Pei_2019, title={Wind Turbine Power Curve Modeling with a Hybrid Machine Learning Technique}, volume={9}, ISSN={2076-3417}, url={http://dx.doi.org/10.3390/app9224930}, DOI={10.3390/app9224930}, number={22}, journal={Applied Sciences}, publisher={MDPI AG}, author={Pei, Shenglei and Li, Yifen}, year={2019}, month=nov, pages={4930} }",https://doi.org/10.3390/app9224930,True,True,True,Wind Speed Only,"Logistic Function, Modified hyperbolic tangent function, Feed forward NN, adaptive neuro-fuzzy
interference system, Extreme Learning Machine","MAE, RMSE, NMAPE, R^2",,,,,,,"Xichang, China; Hunan,China",,,,,No,No
"Lledó, Ll; Torralba, Verónica; Soret, Albert; Ramon, Jaume; Doblas-Reyes, Francisco J; ",Seasonal forecasts of wind power generation,Renewable Energy,143.0,,91-100,2019,Elsevier,wind power curve,2025-06-12,10.1016/j.renene.2019.04.135,"@article{Lled__2019, title={Seasonal forecasts of wind power generation}, volume={143}, ISSN={0960-1481}, url={http://dx.doi.org/10.1016/j.renene.2019.04.135}, DOI={10.1016/j.renene.2019.04.135}, journal={Renewable Energy}, publisher={Elsevier BV}, author={Lledó, Ll. and Torralba, V. and Soret, A. and Ramon, J. and Doblas-Reyes, F.J.}, year={2019}, month=dec, pages={91–100} }",https://doi.org/10.1016/j.renene.2019.04.135,True,False,True,,,None,,,,,,,,,,,,,
"Wang, Yun; Hu, Qinghua; Pei, Shenglei; ",Wind power curve modeling with asymmetric error distribution,IEEE Transactions on Sustainable Energy,11.0,3.0,1199-1209,2019,IEEE,power curve model,2025-06-12,10.1109/tste.2019.2920386,"@article{Wang_2020, title={Wind Power Curve Modeling With Asymmetric Error Distribution}, volume={11}, ISSN={1949-3037}, url={http://dx.doi.org/10.1109/tste.2019.2920386}, DOI={10.1109/tste.2019.2920386}, number={3}, journal={IEEE Transactions on Sustainable Energy}, publisher={Institute of Electrical and Electronics Engineers (IEEE)}, author={Wang, Yun and Hu, Qinghua and Pei, Shenglei}, year={2020}, month=jul, pages={1199–1209} }",https://doi.org/10.1109/tste.2019.2920386,True,True,True,Wind Speed Only,"Splines, Logistic Function, Modified hyperbolic tangent function, SVR, Gaussian Process, adaptive neuro-fuzzy
interference system (AFIN), k-NN, Feed forward NN","MAE, RMSE, R^2",,,,Spring and winter; unknown,1min; 10min,,"Saihanba, China; Ningxia, China; Xichang, China; Hunan, China",,,,,No,No
"Pandit, Ravi Kumar; Infield, David; Carroll, James; ",Incorporating air density into a Gaussian process wind turbine power curve model for improving fitting accuracy,Wind Energy,22.0,2.0,302-315,2019,Wiley Online Library,power curve model,2025-06-12,10.1002/we.2285,"@article{Pandit_2018, title={Incorporating air density into a Gaussian process wind turbine power curve model for improving fitting accuracy}, volume={22}, ISSN={1099-1824}, url={http://dx.doi.org/10.1002/we.2285}, DOI={10.1002/we.2285}, number={2}, journal={Wind Energy}, publisher={Wiley}, author={Pandit, Ravi Kumar and Infield, David and Carroll, James}, year={2018}, month=oct, pages={302–315} }",https://doi.org/10.1002/we.2285,True,True,True,Air Density,Gaussian Process,"MAE, MSE, MAPE, RMSE, R^2",,01-02-2010;01-08-2010,28-02-2010;31-08-2010,,,,,,,,,No,No
"Pandit, Ravi Kumar; Infield, David; Kolios, Athanasios; ",Comparison of advanced non‐parametric models for wind turbine power curves,IET Renewable Power Generation,13.0,9.0,1503-1510,2019,Wiley Online Library,wind turbine power curve,2025-06-12,10.1049/iet-rpg.2018.5728,"@article{Pandit_2019, title={Comparison of advanced non‐parametric models for wind turbine power curves}, volume={13}, ISSN={1752-1424}, url={http://dx.doi.org/10.1049/iet-rpg.2018.5728}, DOI={10.1049/iet-rpg.2018.5728}, number={9}, journal={IET Renewable Power Generation}, publisher={Institution of Engineering and Technology (IET)}, author={Pandit, Ravi Kumar and Infield, David and Kolios, Athanasios}, year={2019}, month=apr, pages={1503–1510} }",https://doi.org/10.1049/iet-rpg.2018.5728,True,True,True,Air Density,"Gaussian Process, RF, SVR","RMSE, R^2, MAE",,01-10-2012,31-12-2012,,10min,,Scotland,,2.3 MW,,,,
"Wang, Yun; Hu, Qinghua; Li, Linhao; Foley, Aoife M; Srinivasan, Dipti; ",Approaches to wind power curve modeling: A review and discussion,Renewable and Sustainable Energy Reviews,116.0,,109422,2019,Elsevier,power curve,2025-06-12,10.1016/j.rser.2019.109422,"@article{Wang_2019, title={Approaches to wind power curve modeling: A review and discussion}, volume={116}, ISSN={1364-0321}, url={http://dx.doi.org/10.1016/j.rser.2019.109422}, DOI={10.1016/j.rser.2019.109422}, journal={Renewable and Sustainable Energy Reviews}, publisher={Elsevier BV}, author={Wang, Yun and Hu, Qinghua and Li, Linhao and Foley, Aoife M. and Srinivasan, Dipti}, year={2019}, month=dec, pages={109422} }",https://doi.org/10.1016/j.rser.2019.109422,False,True,True,,,None,,,,,,,,,,,,,
"Yan, Jie; Zhang, Hao; Liu, Yongqian; Han, Shuang; Li, Li; ",Uncertainty estimation for wind energy conversion by probabilistic wind turbine power curve modelling,Applied energy,239.0,,1356-1370,2019,Elsevier,power curve,2025-06-12,10.1016/j.apenergy.2019.01.180,"@article{Yan_2019, title={Uncertainty estimation for wind energy conversion by probabilistic wind turbine power curve modelling}, volume={239}, ISSN={0306-2619}, url={http://dx.doi.org/10.1016/j.apenergy.2019.01.180}, DOI={10.1016/j.apenergy.2019.01.180}, journal={Applied Energy}, publisher={Elsevier BV}, author={Yan, Jie and Zhang, Hao and Liu, Yongqian and Han, Shuang and Li, Li}, year={2019}, month=apr, pages={1356–1370} }",https://doi.org/10.1016/j.apenergy.2019.01.180,True,True,True,"Wind Direction, Blade Pitch Angle","Feed forward NN, MCS, Fuzzy Clustering","RMSE, MAE, Expected Variance Ratio (EVR)",,01-01-2014;01-01-2017,31-12-2014;31-12-2017,,10min,24;33,northeast China; coastel area china,,2MW; 1.5MW,,,No,No
"Pandit, Ravi Kumar; Infield, David; ",Comparative analysis of Gaussian process power curve models based on different stationary covariance functions for the purpose of improving model accuracy,Renewable Energy,140.0,,190-202,2019,Elsevier,power curve model,2025-06-12,10.1016/j.renene.2019.03.047,"@article{Pandit_2019, title={Comparative analysis of Gaussian Process power curve models based on different stationary covariance functions for the purpose of improving model accuracy}, volume={140}, ISSN={0960-1481}, url={http://dx.doi.org/10.1016/j.renene.2019.03.047}, DOI={10.1016/j.renene.2019.03.047}, journal={Renewable Energy}, publisher={Elsevier BV}, author={Pandit, Ravi Kumar and Infield, David}, year={2019}, month=sep, pages={190–202} }",https://doi.org/10.1016/j.renene.2019.03.047,True,True,True,Wind Speed Only,Gaussian Process,"MAE, R^2, RMSE",,1/1/2012,31/1/2012,,10 min,,"Scotland, UK",>100,2.3,,2538,No,No
"Vahidzadeh, Mohsen; Markfort, Corey D; ",Modified power curves for prediction of power output of wind farms,Energies,12.0,9,1805,2019,MDPI,wind farm power curve,2025-06-12,10.3390/en12091805,"@article{Vahidzadeh_2019, title={Modified Power Curves for Prediction of Power Output of Wind Farms}, volume={12}, ISSN={1996-1073}, url={http://dx.doi.org/10.3390/en12091805}, DOI={10.3390/en12091805}, number={9}, journal={Energies}, publisher={MDPI AG}, author={Vahidzadeh, Mohsen and Markfort, Corey D.}, year={2019}, month=may, pages={1805} }",https://doi.org/10.3390/en12091805,True,True,True,"Humidity, Ambient Temperature, Air Pressure, Blade Pitch Angle","IEC Standard, Power Surface","RMSE, MAE",Clipper Liberty 2.5 MW turbine,20.02.2018,18.06.2018,,1 second and 10 minute,1,Kirkwood community college ,6,"2,5 (downgraded to 2,3)",Onshore,,No,No
"Tao, Siyu; Xu, Qingshan; Feijóo, Andrés; Kuenzel, Stefanie; Bokde, Neeraj; ",Integrated wind farm power curve and power curve distribution function considering the wake effect and terrain gradient,Energies,12.0,13,2482,2019,MDPI,wind farm power curve,2025-06-12,10.3390/en12132482,"@article{Tao_2019, title={Integrated Wind Farm Power Curve and Power Curve Distribution Function Considering the Wake Effect and Terrain Gradient}, volume={12}, ISSN={1996-1073}, url={http://dx.doi.org/10.3390/en12132482}, DOI={10.3390/en12132482}, number={13}, journal={Energies}, publisher={MDPI AG}, author={Tao, Siyu and Xu, Qingshan and Feijóo, Andrés and Kuenzel, Stefanie and Bokde, Neeraj}, year={2019}, month=jun, pages={2482} }",https://doi.org/10.3390/en12132482,True,True,True,"Wind Shear, Air Density, Terrain Gradient","Jensen's Wake Model, Logistic Function, Weibull CDF model",None,Simulated dataset,,,,,25,,,2,Onshore,,No,No
"Ciulla, Giuseppina; D’Amico, Antonino; Di Dio, V; Brano, V Lo; ",Modelling and analysis of real-world wind turbine power curves: Assessing deviations from nominal curve by neural networks,Renewable energy,140.0,,477-492,2019,Elsevier,wind farm power curve,2025-06-12,10.1016/j.renene.2019.03.075,"@article{Ciulla_2019, title={Modelling and analysis of real-world wind turbine power curves: Assessing deviations from nominal curve by neural networks}, volume={140}, ISSN={0960-1481}, url={http://dx.doi.org/10.1016/j.renene.2019.03.075}, DOI={10.1016/j.renene.2019.03.075}, journal={Renewable Energy}, publisher={Elsevier BV}, author={Ciulla, G. and D’Amico, A. and Di Dio, V. and Lo Brano, V.}, year={2019}, month=sep, pages={477–492} }",https://doi.org/10.1016/j.renene.2019.03.075,True,True,True,"Wind Direction, Humidity, Ambient Temperature, Turbulence Intensity, Air Pressure","MLP, Splines, Ordinary Least Squares, Fourier Series Interpolation","MAE, Median Absolute Error, R^2",SENVION MM92 (Commercial real plant),,,1 year,10 min,2,"Southern Italy (area is characterized by a simple and flat orography, free of natural obstructions)",10,"2,05",Onshore,,No,No
"Yan, Chi; Pan, Yang; Archer, Cristina L; ",A general method to estimate wind farm power using artificial neural networks,Wind Energy,22.0,11,1421-1432,2019,Wiley Online Library,wind farm power curve,2025-06-12,10.1002/we.2379,"@article{Yan_2019, title={A general method to estimate wind farm power using artificial neural networks}, volume={22}, ISSN={1099-1824}, url={http://dx.doi.org/10.1002/we.2379}, DOI={10.1002/we.2379}, number={11}, journal={Wind Energy}, publisher={Wiley}, author={Yan, Chi and Pan, Yang and Archer, Cristina L.}, year={2019}, month=jul, pages={1421–1432} }",https://doi.org/10.1002/we.2379,True,True,True,"Wind Direction, yaw angle",ANN,"MAE, RMSE, AE",,"1/8/2009, 1/11/2006","31/5/2016, 28/02/2008",,1+10min,48+13,"Lillgrund, Sweden/Nørrekær, Denmark",3+2,2.3,Beides,,No,No
"Seo, Seokho; Oh, Si-Doek; Kwak, Ho-Young; ",Wind turbine power curve modeling using maximum likelihood estimation method,Renewable energy,136.0,,1164-1169,2019,Elsevier,power curve,2025-06-12,10.1016/j.renene.2018.09.087,"@article{Seo_2019, title={Wind turbine power curve modeling using maximum likelihood estimation method}, volume={136}, ISSN={0960-1481}, url={http://dx.doi.org/10.1016/j.renene.2018.09.087}, DOI={10.1016/j.renene.2018.09.087}, journal={Renewable Energy}, publisher={Elsevier BV}, author={Seo, Seokho and Oh, Si-Doek and Kwak, Ho-Young}, year={2019}, month=jun, pages={1164–1169} }",https://doi.org/10.1016/j.renene.2018.09.087,True,True,True,Wind Speed Only,MLE,"AE, RMSE",,,,1 year,10 min,,South Korea,1,0.8,Onshore,,No,No
"van der Laan, Maarten Paul; Andersen, Søren Juhl; Ramos García, Néstor; Angelou, Nikolas; Pirrung, Georg Raimund; Ott, Søren; Sjöholm, Mikael; Sørensen, Kim Hylling; Vianna Neto, Julio Xavier; Kelly, Mark; ",Power curve and wake analyses of the Vestas multi-rotor demonstrator,Wind Energy Science,4.0,2.0,251-271,2019,Copernicus GmbH,power curve,2025-06-12,10.5194/wes-2018-77,"@article{van_der_Laan_2019, title={Power curve and wake analyses of the Vestas multi-rotor demonstrator}, url={http://dx.doi.org/10.5194/wes-2018-77}, DOI={10.5194/wes-2018-77}, publisher={Copernicus GmbH}, author={van der Laan, Maarten Paul and Anderson, Søren Juhl and Ramos García, Néstor and Angelou, Nikolas and Pirrung, Georg Raimund and Ott, Søren and Sjöholm, Mikael and Sørensen, Kim Hylling and Vianna Neto, Julio Xavier and Kelly, Mark and Mikkelsen, Torben Krogh and Larsen, Gunner Christian}, year={2019}, month=jan }",https://doi.org/10.5194/wes-2018-77,True,False,True,,,None,,,,,,,,,,,,,
"Zhang, Jinhua; Yan, Jie; Infield, David; Liu, Yongqian; Lien, Fue-sang; ",Short-term forecasting and uncertainty analysis of wind turbine power based on long short-term memory network and Gaussian mixture model,Applied Energy,241.0,,229-244,2019,Elsevier,wind turbine power,2025-06-13,10.1016/j.apenergy.2019.03.044,"@article{Zhang_2019, title={Short-term forecasting and uncertainty analysis of wind turbine power based on long short-term memory network and Gaussian mixture model}, volume={241}, ISSN={0306-2619}, url={http://dx.doi.org/10.1016/j.apenergy.2019.03.044}, DOI={10.1016/j.apenergy.2019.03.044}, journal={Applied Energy}, publisher={Elsevier BV}, author={Zhang, Jinhua and Yan, Jie and Infield, David and Liu, Yongqian and Lien, Fue-sang}, year={2019}, month=may, pages={229–244} }",https://doi.org/10.1016/j.apenergy.2019.03.044,True,True,True,Wind Direction,"LSTM, Radial Basis Function (RBF), Deep Belief Network (DBN), Wavelet, Feed forward NN, Recurrent Neural Network (RNN)","MAE, RMSE",,,,"""first quarter of 2010""",15min,123,North China,,1.5MW,,,No,No
"Habibi, Hamed; Howard, Ian; Simani, Silvio; ",Reliability improvement of wind turbine power generation using model-based fault detection and fault tolerant control: A review,Renewable energy,135.0,,877-896,2019,Elsevier,wind turbine power,2025-06-13,10.1016/j.renene.2018.12.066,"@article{Habibi_2019, title={Reliability improvement of wind turbine power generation using model-based fault detection and fault tolerant control: A review}, volume={135}, ISSN={0960-1481}, url={http://dx.doi.org/10.1016/j.renene.2018.12.066}, DOI={10.1016/j.renene.2018.12.066}, journal={Renewable Energy}, publisher={Elsevier BV}, author={Habibi, Hamed and Howard, Ian and Simani, Silvio}, year={2019}, month=may, pages={877–896} }",https://doi.org/10.1016/j.renene.2018.12.066,False,False,True,,,None,,,,,,,,,,,,,
"Pandit, Ravi; Infield, David; ",Comparative analysis of binning and support vector regression for wind turbine rotor speed based power curve use in condition monitoring,2018 53rd International Universities Power Engineering Conference (UPEC),,,1-6,2018,IEEE,power curve monitoring,2025-06-12,10.1109/upec.2018.8542057,"@inproceedings{Pandit_2018, title={Comparative analysis of binning and support vector regression for wind turbine rotor speed based power curve use in condition monitoring}, url={http://dx.doi.org/10.1109/upec.2018.8542057}, DOI={10.1109/upec.2018.8542057}, booktitle={2018 53rd International Universities Power Engineering Conference (UPEC)}, publisher={IEEE}, author={Pandit, Ravi and Infield, David}, year={2018}, month=sep, pages={1–6} }\n",https://doi.org/10.1109/upec.2018.8542057,True,True,True,"Air Pressure, Ambient Temperature, Air Density, Rotor RPM","IEC Standard, SVR",None,,07.01.2012,31.12.2012,,10 min,1,"Scotland, UK",>100,"2,3",,,No,No
"Javadi, Milad; Malyscheff, Alexander M; Wu, Di; Kang, Chongqing; Jiang, John N; ",An algorithm for practical power curve estimation of wind turbines,CSEE Journal of Power and Energy Systems,4.0,1.0,93-102,2018,CSEE,power curve estimation,2025-06-12,10.17775/cseejpes.2016.00980,"@article{2018, title={An algorithm for practical power curve estimation of wind turbines}, volume={4}, ISSN={2096-0042}, url={http://dx.doi.org/10.17775/cseejpes.2016.00980}, DOI={10.17775/cseejpes.2016.00980}, number={1}, journal={CSEE Journal of Power and Energy Systems}, publisher={Power System Technology Press}, author={Javadi, Milad and Malyscheff, Alexander M. and Wu, Di and Kang, Chongqing and Jiang, John N.}, year={2018}, month=mar, pages={93–102} }",https://doi.org/10.17775/cseejpes.2016.00980,True,True,True,Wind Speed Only,Piece-wise Linear Regression,MSE,,,,1 year,5 min,1,,1,,,,No,No
"Hayashi, Daisuke; Huenteler, Joern; Lewis, Joanna I; ",Gone with the wind: A learning curve analysis of China's wind power industry,Energy Policy,120.0,,38-51,2018,Elsevier,wind power curve,2025-06-12,10.1016/j.enpol.2018.05.012,"@article{Hayashi_2018, title={Gone with the wind: A learning curve analysis of China’s wind power industry}, volume={120}, ISSN={0301-4215}, url={http://dx.doi.org/10.1016/j.enpol.2018.05.012}, DOI={10.1016/j.enpol.2018.05.012}, journal={Energy Policy}, publisher={Elsevier BV}, author={Hayashi, Daisuke and Huenteler, Joern and Lewis, Joanna I.}, year={2018}, month=sep, pages={38–51} }",https://doi.org/10.1016/j.enpol.2018.05.012,True,False,True,,,None,,,,,,,,,,,,,
"Guo, Peng; Infield, David; ",Wind turbine power curve modeling and monitoring with Gaussian process and SPRT,IEEE Transactions on Sustainable Energy,11.0,1.0,107-115,2018,IEEE,power curve,2025-06-12,10.1109/tste.2018.2884699,"@article{Guo_2020, title={Wind Turbine Power Curve Modeling and Monitoring With Gaussian Process and SPRT}, volume={11}, ISSN={1949-3037}, url={http://dx.doi.org/10.1109/tste.2018.2884699}, DOI={10.1109/tste.2018.2884699}, number={1}, journal={IEEE Transactions on Sustainable Energy}, publisher={Institute of Electrical and Electronics Engineers (IEEE)}, author={Guo, Peng and Infield, David}, year={2020}, month=jan, pages={107–115} }",https://doi.org/10.1109/tste.2018.2884699,False,False,True,"Wind Direction, Blade Pitch Angle, Yaw Misalignment, Rotor RPM",Gaussian Process,MAPE,,25-04-2017;08-05-2017,15-06-2017;24-06-2017,,,2,"Anhui province, China",,1.5MW,,,No,No
"Ranneberg, Maximilian; Wölfle, David; Bormann, Alexander; Rohde, Peter; Breipohl, Florian; Bastigkeit, Ilona; ",Fast power curve and yield estimation of pumping airborne wind energy systems,Airborne wind energy: Advances in technology development and research,,,623-641,2018,Springer,wind energy power curve,2025-06-12,10.1007/978-981-10-1947-0_25,"@inbook{Ranneberg_2018, title={Fast Power Curve and Yield Estimation of Pumping Airborne Wind Energy Systems}, ISBN={9789811019470}, ISSN={1865-3537}, url={http://dx.doi.org/10.1007/978-981-10-1947-0_25}, DOI={10.1007/978-981-10-1947-0_25}, booktitle={Airborne Wind Energy}, publisher={Springer Singapore}, author={Ranneberg, Maximilian and Wölfle, David and Bormann, Alexander and Rohde, Peter and Breipohl, Florian and Bastigkeit, Ilona}, year={2018}, pages={623–641} }",https://doi.org/10.1007/978-981-10-1947-0_25,True,False,True,,,None,,,,,,,,,,,,,
"Villanueva, Daniel; Feijóo, Andrés; ",Comparison of logistic functions for modeling wind turbine power curves,Electric Power Systems Research,155.0,,281-288,2018,Elsevier,wind turbine power curve,2025-06-12,10.1016/j.epsr.2017.10.028,"@article{Villanueva_2018, title={Comparison of logistic functions for modeling wind turbine power curves}, volume={155}, ISSN={0378-7796}, url={http://dx.doi.org/10.1016/j.epsr.2017.10.028}, DOI={10.1016/j.epsr.2017.10.028}, journal={Electric Power Systems Research}, publisher={Elsevier BV}, author={Villanueva, Daniel and Feijóo, Andrés}, year={2018}, month=feb, pages={281–288} }",https://doi.org/10.1016/j.epsr.2017.10.028,True,True,True,Wind Speed Only,Logistic Function,"MAPE, MAE, RMSE",,,,,,"7 (V80, E82, S82, R82, N90, S107, V164)",,,"2; 2,05; 2,3; 2,05; 2,3; 3,6; 6,995",,,No,No
"Bokde, Neeraj; Feijóo, Andrés; Villanueva, Daniel; ",Wind turbine power curves based on the weibull cumulative distribution function,Applied Sciences,8.0,10.0,1757,2018,MDPI,wind turbine power curve,2025-06-12,10.3390/app8101757,"@article{Bokde_2018, title={Wind Turbine Power Curves Based on the Weibull Cumulative Distribution Function}, volume={8}, ISSN={2076-3417}, url={http://dx.doi.org/10.3390/app8101757}, DOI={10.3390/app8101757}, number={10}, journal={Applied Sciences}, publisher={MDPI AG}, author={Bokde, Neeraj and Feijóo, Andrés and Villanueva, Daniel}, year={2018}, month=sep, pages={1757} }",https://doi.org/10.3390/app8101757,True,True,True,Wind Speed Only,Weibull CDF model,"RMSE, MAE",,,,,,6,UK,1,,Beides,,No,No
"Lydia, M; Suresh Kumar, S; Immanuel Selvakumar, A; Edwin Prem Kumar, G; ",Wind farm power prediction based on wind speed and power curve models,Intelligent and Efficient Electrical Systems: Selected Proceedings of ICIEES’17,,,15-24,2018,Springer,wind farm power curve,2025-06-12,10.1007/978-981-10-4852-4_2,"@inbook{Lydia_2017, title={Wind Farm Power Prediction Based on Wind Speed and Power Curve Models}, ISBN={9789811048524}, ISSN={1876-1119}, url={http://dx.doi.org/10.1007/978-981-10-4852-4_2}, DOI={10.1007/978-981-10-4852-4_2}, booktitle={Intelligent and Efficient Electrical Systems}, publisher={Springer Singapore}, author={Lydia, M. and Suresh Kumar, S. and Immanuel Selvakumar, A. and Edwin Prem Kumar, G.}, year={2017}, month=dec, pages={15–24} }",https://doi.org/10.1007/978-981-10-4852-4_2,True,True,False,,,None,,,,,,,,,,,,,
