Authors,Title,Publication,Volume,Number,Pages,Year,Publisher,search-query,query-date,doi,bibtex,doi_link,No Survey / Literature Review,Contains Experiments and Results for WTPC,Full Text Available,Used Features,Used Models,Used Evaluation Metrics,Dataset Description,Dataset From Date,Dataset To Date,Time period,Granularity,Number of Turbines,Location,Available Features,Power per WT,Onshore/Offshore?,Observed Failures,Dataset Availability,Source Code Availability
"Li, Yanting; Wang, Peng; Wu, Zhenyu; Su, Yan; ",Collaborative monitoring of wind turbine performance based on probabilistic power curve comparison,Renewable Energy,231.0,,120919,2024,Elsevier,power curve monitoring,2025-06-12,10.1016/j.renene.2024.120919,"@article{Li_2024, title={Collaborative monitoring of wind turbine performance based on probabilistic power curve comparison}, volume={231}, ISSN={0960-1481}, url={http://dx.doi.org/10.1016/j.renene.2024.120919}, DOI={10.1016/j.renene.2024.120919}, journal={Renewable Energy}, publisher={Elsevier BV}, author={Li, Yanting and Wang, Peng and Wu, Zhenyu and Su, Yan}, year={2024}, month=sep, pages={120919} }",https://doi.org/10.1016/j.renene.2024.120919,True,False,True,,,None,,,,,,,,,,,,,
"Sebastiani, Alessandro; Angelou, Nikolas; Peña, Alfredo; ",Wind turbine power curve modelling under wake conditions using measurements from a spinner-mounted lidar,Applied Energy,364.0,,122985,2024,Elsevier,power curve modelling,2025-06-12,10.1016/j.apenergy.2024.122985,"@article{Sebastiani_2024, title={Wind turbine power curve modelling under wake conditions using measurements from a spinner-mounted lidar}, volume={364}, ISSN={0306-2619}, url={http://dx.doi.org/10.1016/j.apenergy.2024.122985}, DOI={10.1016/j.apenergy.2024.122985}, journal={Applied Energy}, publisher={Elsevier BV}, author={Sebastiani, Alessandro and Angelou, Nikolas and Peña, Alfredo}, year={2024}, month=jun, pages={122985} }",https://doi.org/10.1016/j.apenergy.2024.122985,True,True,True,Turbulence Intensity,"IEC Standard, Polynomial regression","RMSE, MAPE",,02-09-2012,11-09-2012,,"10min
(Der Datensatz ist vermutlich deutlich genauer durch den SpinnerLidar, aber die Vorhersagen werden auf Basis von 10min Intervallen gemacht)",8,"Tjæreborg, western Denmark",1424,2.3 MW,Onshore,,No,
"Marti-Puig, Pere; Hernández, Jose Ángel; Solé-Casals, Jordi; Serra-Serra, Moises; ",Enhancing reliability in wind turbine power curve estimation,Applied Sciences,14.0,6.0,2479,2024,MDPI,power curve estimation,2025-06-12,10.3390/app14062479,"@article{Marti_Puig_2024, title={Enhancing Reliability in Wind Turbine Power Curve Estimation}, volume={14}, ISSN={2076-3417}, url={http://dx.doi.org/10.3390/app14062479}, DOI={10.3390/app14062479}, number={6}, journal={Applied Sciences}, publisher={MDPI AG}, author={Marti-Puig, Pere and Hernández, Jose Ángel and Solé-Casals, Jordi and Serra-Serra, Moises}, year={2024}, month=mar, pages={2479} }",https://doi.org/10.3390/app14062479,True,True,True,Wind Speed Only,Feed forward NN,RMSE,fuhrlander,1/1/2012,31/12/2014,,5 min,5,,1,2.5,,1,Yes,No
"Hagar, Luke; Stevens, Nathaniel T; ",Fast power curve approximation for posterior analyses,Bayesian Analysis,1.0,1.0,1-26,2024,International Society for Bayesian Analysis,power curve estimation,2025-06-12,10.1214/24-ba1469,"@article{Hagar_2024, title={Fast Power Curve Approximation for Posterior Analyses}, volume={1}, ISSN={1936-0975}, url={http://dx.doi.org/10.1214/24-ba1469}, DOI={10.1214/24-ba1469}, number={1}, journal={Bayesian Analysis}, publisher={Institute of Mathematical Statistics}, author={Hagar, Luke and Stevens, Nathaniel T.}, year={2024}, month=jan }",https://doi.org/10.1214/24-ba1469,True,False,True,,,None,,,,,,,,,,,,,
"Letzgus, Simon; Müller, Klaus-Robert; ",An explainable AI framework for robust and transparent data-driven wind turbine power curve models,Energy and AI,15.0,,100328,2024,Elsevier,power curve model,2025-06-12,10.1016/j.egyai.2023.100328,"@article{Letzgus_2024, title={An explainable AI framework for robust and transparent data-driven wind turbine power curve models}, volume={15}, ISSN={2666-5468}, url={http://dx.doi.org/10.1016/j.egyai.2023.100328}, DOI={10.1016/j.egyai.2023.100328}, journal={Energy and AI}, publisher={Elsevier BV}, author={Letzgus, Simon and Müller, Klaus-Robert}, year={2024}, month=jan, pages={100328} }",https://doi.org/10.1016/j.egyai.2023.100328,True,True,True,"Air Density, Turbulence Intensity, Yaw Misalignment, Blade Pitch Angle","IEC Standard, Piece-wise Linear Regression, Piece-wise Polynomial Regression, RF, MLP, SVR","R^2, RMSE",EDP,01.01.2016,31.12.2017,,10 min,4,Gulf of Guinea,121,2,Offshore,28,Yes,Yes
"Capelletti, Marco; Raimondo, Davide M; De Nicolao, Giuseppe; ",Wind power curve modeling: A probabilistic Beta regression approach,Renewable Energy,223.0,,119970,2024,Elsevier,power curve model,2025-06-12,10.1016/j.renene.2024.119970,"@article{Capelletti_2024, title={Wind power curve modeling: A probabilistic Beta regression approach}, volume={223}, ISSN={0960-1481}, url={http://dx.doi.org/10.1016/j.renene.2024.119970}, DOI={10.1016/j.renene.2024.119970}, journal={Renewable Energy}, publisher={Elsevier BV}, author={Capelletti, Marco and Raimondo, Davide M. and De Nicolao, Giuseppe}, year={2024}, month=mar, pages={119970} }",https://doi.org/10.1016/j.renene.2024.119970,True,True,True,"Wind Direction, Datetime","GLM, QRF, IEC Standard","MAE, RMSE, R^2, WMAPE, Cross Entropy","A, B, C","1/1/2018, 1/1/2018, 1/1/2016","31/12/2018, 31/3/2020, 1/7/2021",,10 min,je 1,"Turkey, -, Penmanshiel Wind Farm (UK)",3; 2; 2,2,Onshore,,Yes,No
"Qiao, Yanhui; Han, Shuang; Zhang, Yajie; Liu, Yongqian; Yan, Jie; ",A multivariable wind turbine power curve modeling method considering segment control differences and short-time self-dependence,Renewable Energy,222.0,,119894,2024,Elsevier,power curve model,2025-06-12,10.1016/j.renene.2023.119894,"@article{Qiao_2024, title={A multivariable wind turbine power curve modeling method considering segment control differences and short-time self-dependence}, volume={222}, ISSN={0960-1481}, url={http://dx.doi.org/10.1016/j.renene.2023.119894}, DOI={10.1016/j.renene.2023.119894}, journal={Renewable Energy}, publisher={Elsevier BV}, author={Qiao, Yanhui and Han, Shuang and Zhang, Yajie and Liu, Yongqian and Yan, Jie}, year={2024}, month=feb, pages={119894} }",https://doi.org/10.1016/j.renene.2023.119894,True,True,True,"Ambient Temperature, Generator speed, Wind Direction, Air Pressure, Turbulence Intensity, Wind Shear, Air Density","LSTM, GRU","RMSE, MAE",,,,,10 min,2,China,5,1.5,Onshore,,No,No
"Teshome, Abeba Debru; Kahsay, Mulu Bayray; Cabrera, Maria Marta Molinas; ",Assessment of power curve performance of wind turbines in Adama-II Wind Farm,Energy Reports,12.0,,2209-2223,2024,Elsevier,wind farm power curve,2025-06-12,10.1016/j.egyr.2024.07.060,"@article{Teshome_2024, title={Assessment of power curve performance of wind turbines in Adama-II Wind Farm}, volume={12}, ISSN={2352-4847}, url={http://dx.doi.org/10.1016/j.egyr.2024.07.060}, DOI={10.1016/j.egyr.2024.07.060}, journal={Energy Reports}, publisher={Elsevier BV}, author={Teshome, Abeba Debru and Kahsay, Mulu Bayray and Molinas Cabrera, Maria Marta}, year={2024}, month=dec, pages={2209–2223} }",https://doi.org/10.1016/j.egyr.2024.07.060,True,True,True,"Humidity, Air Pressure, Air Density, Ambient Temperature",ANN,"MAE, RMSE, R^2",2017 SCADA & mast data of Adama-II Wind Farm,01.01.2017,31.12.2017,,10 min,3,"Adama-II Wind Farm, South-East Ethiopia",,"1,5009",Onshore,,On Request,No
"Wang, Yun; Duan, Xiaocong; Song, Dongran; Zou, Runmin; Zhang, Fan; Li, Yifen; ",Wind power curve modeling with large-scale generalized kernel-based regression model,IEEE Transactions on Sustainable Energy,14.0,4.0,2121-2132,2023,IEEE,power curve model,2025-06-12,10.1109/tste.2023.3276906,"@article{Wang_2023, title={Wind Power Curve Modeling With Large-Scale Generalized Kernel-Based Regression Model}, volume={14}, ISSN={1949-3037}, url={http://dx.doi.org/10.1109/tste.2023.3276906}, DOI={10.1109/tste.2023.3276906}, number={4}, journal={IEEE Transactions on Sustainable Energy}, publisher={Institute of Electrical and Electronics Engineers (IEEE)}, author={Wang, Yun and Duan, Xiaocong and Song, Dongran and Zou, Runmin and Zhang, Fan and Li, Yifen}, year={2023}, month=oct, pages={2121–2132} }",https://doi.org/10.1109/tste.2023.3276906,True,True,True,"Turbulence Intensity, Air Density, Wind Direction, Wind Shear",AMK,"MAE, RMSE, NMAPE, R^2",,"(1) 15-03-2018
(2) 01-04-202
(3) 01-01-2020
(4) 04-04-2018","(1) 15-11-2015
(2) 31-12-2020
(3) 30-03-2020
(4) 10-06-2018",,10min for all datasets,,"(1) Turkey
(2)
(3)
(4) Nanjing, China",,,Beides,,Yes,No
"Jing, Hua; Zhao, Chun-hui; ",A data expansion based piecewise regression strategy for incrementally monitoring the wind turbine with power curve,Journal of Central South University,30.0,5.0,1601-1617,2023,Springer,power curve monitoring,2025-06-12,0.1007/s11771-023-5325-5,"@article{Jing_2023, title={A data expansion based piecewise regression strategy for incrementally monitoring the wind turbine with power curve}, volume={30}, ISSN={2227-5223}, url={http://dx.doi.org/10.1007/s11771-023-5325-5}, DOI={10.1007/s11771-023-5325-5}, number={5}, journal={Journal of Central South University}, publisher={Springer Science and Business Media LLC}, author={Jing, Hua and Zhao, Chun-hui}, year={2023}, month=may, pages={1601–1617} }",https://doi.org/10.1007/s11771-023-5325-5,True,True,True,"Wind Direction, Rotor RPM, Generator speed, Gear Shaft Speed, Component Temperature(s)","Relevance Vector Machine, Incremental Learning","R^2, MAE, MSE",,,,,,"2 (one newly installed, one long-running)",Southeastern China,,,,1503 abnormal observations,No,No
"Mclean, Jacques H; Jones, Matthew R; O’Connell, Brandon J; Maguire, Eoghan; Rogers, Tim J; ",Physically meaningful uncertainty quantification in probabilistic wind turbine power curve models as a damage-sensitive feature,Structural Health Monitoring,22.0,6.0,3623-3636,2023,"SAGE Publications Sage UK: London, England",power curve monitoring,2025-06-12,10.1177/14759217231155379,"@article{Mclean_2023, title={Physically meaningful uncertainty quantification in probabilistic wind turbine power curve models as a damage-sensitive feature}, volume={22}, ISSN={1741-3168}, url={http://dx.doi.org/10.1177/14759217231155379}, DOI={10.1177/14759217231155379}, number={6}, journal={Structural Health Monitoring}, publisher={SAGE Publications}, author={Mclean, Jacques H and Jones, Matthew R and O’Connell, Brandon J and Maguire, Eoghan and Rogers, Tim J}, year={2023}, month=feb, pages={3623–3636} }",https://doi.org/10.1177/14759217231155379,True,True,True,Wind Speed Only,Gaussian Process,"NMSE, joint log likelihood",,,,,10 min,1,,1,,,,No,Yes
"Astolfi, Davide; De Caro, Fabrizio; Vaccaro, Alfredo; ",Enhancing wind turbine power curve monitoring with explainable artificial intelligence techniques,IEEE EUROCON 2023-20th International Conference on Smart Technologies,,,758-763,2023,IEEE,power curve monitoring,2025-06-12,10.1109/eurocon56442.2023.10199016,"@inproceedings{Astolfi_2023, title={Enhancing Wind Turbine Power Curve Monitoring with eXplainable Artificial Intelligence Techniques}, url={http://dx.doi.org/10.1109/eurocon56442.2023.10199016}, DOI={10.1109/eurocon56442.2023.10199016}, booktitle={IEEE EUROCON 2023 - 20th International Conference on Smart Technologies}, publisher={IEEE}, author={Astolfi, Davide and De Caro, Fabrizio and Vaccaro, Alfredo}, year={2023}, month=jul, pages={758–763} }",https://doi.org/10.1109/eurocon56442.2023.10199016,True,True,True,"Rotor RPM, Tower Acceleration, Blade Load, Blade Loads Bearing Tilt Moment, Blade Piston Travelled Distance, Blade Loads Bearing Yaw Moment, Blade Pitch Travelled Distance, Tower Vibrations, Tilt Yaw Control, Tilt Moment, Yaw Moment, Blade Pitch Cylinder Pressure, Blade Pitch Manifold Oil Pressure, Blade Pitch Angle",SVR,"MAE, RMSE, SHAP",Vestas V117 wind turbine (rated power 3.4 MW),01.01.2020,31.12.2020,,10 min,1,Italy?,26,"3,4",,,On Request,No
"Wang, Peng; Li, Yanting; Zhang, Guangyao; ",Probabilistic power curve estimation based on meteorological factors and density LSTM,Energy,269.0,,126768,2023,Elsevier,power curve estimation,2025-06-12,10.2139/ssrn.4257455,"@article{Wang_2022, title={Probabilistic Power Curve Estimation Based on Meteorological Factors and Density Lstm}, ISSN={1556-5068}, url={http://dx.doi.org/10.2139/ssrn.4257455}, DOI={10.2139/ssrn.4257455}, journal={SSRN Electronic Journal}, publisher={Elsevier BV}, author={Wang, Peng and LI, Yanting and Zhang, Guangyao}, year={2022} }",https://doi.org/10.2139/ssrn.4257455,True,True,True,"Wind Direction, Ambient Temperature",LSTM,"MSC, CRPS, Reliability Index, sharpness",,1/1/2019,31/12/2019,,10 min,24/26,Central and East China,4,2/4,Beides,2434/3012,No,No
"Wang, Zhiming; Wang, Xuan; Liu, Weimin; ",Genetic least square estimation approach to wind power curve modelling and wind power prediction,Scientific Reports,13.0,1.0,9188,2023,Nature Publishing Group UK London,power curve estimation,2025-06-12,10.1038/s41598-023-36458-w,"@article{Wang_2023, title={Genetic least square estimation approach to wind power curve modelling and wind power prediction}, volume={13}, ISSN={2045-2322}, url={http://dx.doi.org/10.1038/s41598-023-36458-w}, DOI={10.1038/s41598-023-36458-w}, number={1}, journal={Scientific Reports}, publisher={Springer Science and Business Media LLC}, author={Wang, Zhiming and Wang, Xuan and Liu, Weimin}, year={2023}, month=jun }",https://doi.org/10.1038/s41598-023-36458-w,True,True,True,Wind Speed Only,"Piece-wise Polynomial Regression, Logistic Function","RMSE, R^2, MAE, MAPE, AIC, BIC","""1# wind farm Maling Mountain""; ""2# wind farm Mishan Mountain""",01.01.2018,31.12.2018,,10 min,28; ?,"Jiangsu Province, China",2,"1,8; 1,5",Onshore,,No,No
"Paik, Chunhyun; Chung, Yongjoo; Kim, Young Jin; ",Power curve modeling of wind turbines through clustering-based outlier elimination,Applied System Innovation,6.0,2.0,41,2023,MDPI,power curve estimation,2025-06-12,10.3390/asi6020041,"@article{Paik_2023, title={Power Curve Modeling of Wind Turbines through Clustering-Based Outlier Elimination}, volume={6}, ISSN={2571-5577}, url={http://dx.doi.org/10.3390/asi6020041}, DOI={10.3390/asi6020041}, number={2}, journal={Applied System Innovation}, publisher={MDPI AG}, author={Paik, Chunhyun and Chung, Yongjoo and Kim, Young Jin}, year={2023}, month=mar, pages={41} }",https://doi.org/10.3390/asi6020041,True,True,True,Wind Speed Only,Polynomial regression,"R^2, RMSE, MAE",,2018,2020,,,2,Korea,,1.5/3,Onshore,,On Request,No
"Wang, Yun; Duan, Xiaocong; Zou, Runmin; Zhang, Fan; Li, Yifen; Hu, Qinghua; ",A novel data-driven deep learning approach for wind turbine power curve modeling,Energy,270.0,,126908.0,2023,Elsevier,power curve modeling,2025-06-12,10.1016/j.energy.2023.126908,"@article{Wang_2023, title={A novel data-driven deep learning approach for wind turbine power curve modeling}, volume={270}, ISSN={0360-5442}, url={http://dx.doi.org/10.1016/j.energy.2023.126908}, DOI={10.1016/j.energy.2023.126908}, journal={Energy}, publisher={Elsevier BV}, author={Wang, Yun and Duan, Xiaocong and Zou, Runmin and Zhang, Fan and Li, Yifen and Hu, Qinghua}, year={2023}, month=may, pages={126908} }",https://doi.org/10.1016/j.energy.2023.126908,True,True,True,Wind Speed Only,CNN,"R^2, MAE, RMSE, NMAPE","4 Datensätze, 2 von Kaggle, 2 von Nanjing, China",7.7.2017,31.12.2020,,10 min,,"Nanjing, China",,ca. 2,,,Yes,No
"Yang, Guoming; Zhang, Hao; Wang, Wenting; Liu, Bai; Lyu, Chao; Yang, Dazhi; ",Capacity optimization and economic analysis of PV–hydrogen hybrid systems with physical solar power curve modeling,Energy Conversion and Management,288.0,,117128,2023,Elsevier,power curve model,2025-06-12,10.1016/j.enconman.2023.117128,"@article{Yang_2023, title={Capacity optimization and economic analysis of PV–hydrogen hybrid systems with physical solar power curve modeling}, volume={288}, ISSN={0196-8904}, url={http://dx.doi.org/10.1016/j.enconman.2023.117128}, DOI={10.1016/j.enconman.2023.117128}, journal={Energy Conversion and Management}, publisher={Elsevier BV}, author={Yang, Guoming and Zhang, Hao and Wang, Wenting and Liu, Bai and Lyu, Chao and Yang, Dazhi}, year={2023}, month=jul, pages={117128} }",https://doi.org/10.1016/j.enconman.2023.117128,True,False,True,,,None,,,,,,,,,,,,,
"Zheng, Zhong; Yang, Luoxiao; Zhang, Zijun; ",Conditional variational autoencoder informed probabilistic wind power curve modeling,IEEE Transactions on Sustainable Energy,14.0,4.0,2445-2460,2023,IEEE,power curve model,2025-06-12,10.1109/tste.2023.3283515,"@article{Zheng_2023, title={Conditional Variational Autoencoder Informed Probabilistic Wind Power Curve Modeling}, volume={14}, ISSN={1949-3037}, url={http://dx.doi.org/10.1109/tste.2023.3283515}, DOI={10.1109/tste.2023.3283515}, number={4}, journal={IEEE Transactions on Sustainable Energy}, publisher={Institute of Electrical and Electronics Engineers (IEEE)}, author={Zheng, Zhong and Yang, Luoxiao and Zhang, Zijun}, year={2023}, month=oct, pages={2445–2460} }",https://doi.org/10.1109/tste.2023.3283515,True,True,True,Wind Direction,CVAE,"CRPS, CWC, PINAW, PINRW, ACE, PICP",,1/8/2019,28/2/2020,,10 min,,,2,,,,No,No
"Mushtaq, Khurram; Zou, Runmin; Waris, Asim; Yang, Kaifeng; Wang, Ji; Iqbal, Javaid; Jameel, Mohammed; ",Multivariate wind power curve modeling using multivariate adaptive regression splines and regression trees,Plos One,18.0,8.0,e0290316,2023,"Public Library of Science San Francisco, CA USA",power curve model,2025-06-12,10.1371/journal.pone.0290316,"@article{Mushtaq_2023, title={Multivariate wind power curve modeling using multivariate adaptive regression splines and regression trees}, volume={18}, ISSN={1932-6203}, url={http://dx.doi.org/10.1371/journal.pone.0290316}, DOI={10.1371/journal.pone.0290316}, number={8}, journal={PLOS ONE}, publisher={Public Library of Science (PLoS)}, author={Mushtaq, Khurram and Zou, Runmin and Waris, Asim and Yang, Kaifeng and Wang, Ji and Iqbal, Javaid and Jameel, Mohammed}, editor={MAHFOODH, AL}, year={2023}, month=aug, pages={e0290316} }",https://doi.org/10.1371/journal.pone.0290316,True,True,True,Wind Direction,"k-NN, MLP, SVR, Decision Tree, RF, Gradient Boosting Regression, ERT, Splines","MAE, RMSE, R^2",Two Kaggle datasets #1 and #2,01.01.2018,31.03.2020,,10 min,1,Turkey,3,,,,Yes,No
"Jahantigh, Reza; Esmailifar, Sayyed Majid; Sina, Seyyed Ali; ",Wind farm control and power curve optimization using induction-based wake model,Measurement and Control,56.0,9-10,1751-1763,2023,"SAGE Publications Sage UK: London, England",wind farm power curve,2025-06-12,10.1177/00202940231180624,"@article{Jahantigh_2023, title={Wind farm control and power curve optimization using induction-based wake model}, volume={56}, ISSN={0020-2940}, url={http://dx.doi.org/10.1177/00202940231180624}, DOI={10.1177/00202940231180624}, number={9–10}, journal={Measurement and Control}, publisher={SAGE Publications}, author={Jahantigh, Reza and Esmailifar, Sayyed Majid and Sina, Seyyed Ali}, year={2023}, month=jun, pages={1751–1763} }",https://doi.org/10.1177/00202940231180624,True,False,True,"Air Density, Blade Pitch Angle, Generator speed, Rotor RPM, Wind Direction, Axial Induction Factor",,None,,,,,,,,,,,,,
"Nasery, Praanjal; Ezzat, Ahmed Aziz; ",Yaw-adjusted wind power curve modeling: A local regression approach,Renewable Energy,202.0,,1368-1376,2023,Elsevier,power curve,2025-06-12,10.1016/j.renene.2022.12.001,"@article{Nasery_2023, title={Yaw-adjusted wind power curve modeling: A local regression approach}, volume={202}, ISSN={0960-1481}, url={http://dx.doi.org/10.1016/j.renene.2022.12.001}, DOI={10.1016/j.renene.2022.12.001}, journal={Renewable Energy}, publisher={Elsevier BV}, author={Nasery, Praanjal and Aziz Ezzat, Ahmed}, year={2023}, month=jan, pages={1368–1376} }",https://doi.org/10.1016/j.renene.2022.12.001,True,True,True,"Wind Direction, Yaw Misalignment, Ambient Temperature, Air Pressure, Air Density, Turbulence Intensity","IEC Standard, k-NN, AMK",Median Absolute Error,Engie Open Data,01.09.2013,31.12.2013,,10 min,2,Northeastern France (La Haute Borne–Vaudeville-le-Haut),8,"2,05",Onshore,,Yes,No
"Bilendo, Francisco; Badihi, Hamed; Lu, Ningyun; Cambron, Philippe; Jiang, Bin; ",A normal behavior model based on power curve and stacked regressions for condition monitoring of wind turbines,IEEE Transactions on Instrumentation and Measurement,71.0,,1-13,2022,IEEE,power curve monitoring,2025-06-12,10.1109/tim.2022.3196116,"@article{Bilendo_2022, title={A Normal Behavior Model Based on Power Curve and Stacked Regressions for Condition Monitoring of Wind Turbines}, volume={71}, ISSN={1557-9662}, url={http://dx.doi.org/10.1109/tim.2022.3196116}, DOI={10.1109/tim.2022.3196116}, journal={IEEE Transactions on Instrumentation and Measurement}, publisher={Institute of Electrical and Electronics Engineers (IEEE)}, author={Bilendo, Francisco and Badihi, Hamed and Lu, Ningyun and Cambron, Philippe and Jiang, Bin}, year={2022}, pages={1–13} }",https://doi.org/10.1109/tim.2022.3196116,True,True,True,Air Density,"Decision Tree, SVR, RF, AdaBoost","MAE, RMSE",,,,3 years,10 min,1,,,,,approx. 6 severe anomalies,No,No
"Li, Tenghui; Liu, Xiaolei; Lin, Zi; Morrison, Rory; ","Ensemble offshore wind turbine power curve modelling–an integration of isolation forest, fast radial basis function neural network, and metaheuristic algorithm",Energy,239.0,,122340,2022,Elsevier,power curve modelling,2025-06-12,10.1016/j.energy.2021.122340,"@article{Li_2022, title={Ensemble offshore Wind Turbine Power Curve modelling – An integration of Isolation Forest, fast Radial Basis Function Neural Network, and metaheuristic algorithm}, volume={239}, ISSN={0360-5442}, url={http://dx.doi.org/10.1016/j.energy.2021.122340}, DOI={10.1016/j.energy.2021.122340}, journal={Energy}, publisher={Elsevier BV}, author={Li, Tenghui and Liu, Xiaolei and Lin, Zi and Morrison, Rory}, year={2022}, month=jan, pages={122340} }",https://doi.org/10.1016/j.energy.2021.122340,True,True,True,"Nacelle Orientation, Blade Pitch Angle, Ambient Temperature",RBFNN,"MSE, RMSE, NRMSE, MAE, R^2",,01-01-2013,01-12-2014,,10min,4,"Anholt, Denmark",5,3.6 MW,Offshore,,No,No
"Bull, Lawrence A; Gardner, Paul A; Rogers, Timothy J; Dervilis, Nikolaos; Cross, Elizabeth J; Papatheou, Evangelos; Maguire, Andrew Eoghan; Campos, Carles; Worden, Keith; ",Bayesian modelling of multivalued power curves from an operational wind farm,Mechanical Systems and Signal Processing,169.0,,108530,2022,Elsevier,wind farm power curve,2025-06-12,10.1016/j.ymssp.2021.108530,"@article{Bull_2022, title={Bayesian modelling of multivalued power curves from an operational wind farm}, volume={169}, ISSN={0888-3270}, url={http://dx.doi.org/10.1016/j.ymssp.2021.108530}, DOI={10.1016/j.ymssp.2021.108530}, journal={Mechanical Systems and Signal Processing}, publisher={Elsevier BV}, author={Bull, L.A. and Gardner, P.A. and Rogers, T.J. and Dervilis, N. and Cross, E.J. and Papatheou, E. and Maguire, A.E. and Campos, C. and Worden, K.}, year={2022}, month=apr, pages={108530} }",https://doi.org/10.1016/j.ymssp.2021.108530,True,True,True,Wind Speed Only,Gaussian Process,"NMSE, MSD",,,,125 weeks,10min,,,,,,,No,No
"Qian, Guo-Wei; Ishihara, Takeshi; ",A novel probabilistic power curve model to predict the power production and its uncertainty for a wind farm over complex terrain,Energy,261.0,,125171,2022,Elsevier,power curve estimation,2025-06-12,10.1016/j.energy.2022.125171,"@article{Qian_2022, title={A novel probabilistic power curve model to predict the power production and its uncertainty for a wind farm over complex terrain}, volume={261}, ISSN={0360-5442}, url={http://dx.doi.org/10.1016/j.energy.2022.125171}, DOI={10.1016/j.energy.2022.125171}, journal={Energy}, publisher={Elsevier BV}, author={Qian, Guo-Wei and Ishihara, Takeshi}, year={2022}, month=dec, pages={125171} }",https://doi.org/10.1016/j.energy.2022.125171,True,True,True,"Air Pressure, Air Density, Ambient Temperature, Turbulence Intensity, Yaw Misalignment, Wind Direction","PARK model, Beta Distribution Probabilistic Model, Shihara-Qian wake model, LES with Smagorinsky-Lill model",WMAPE,Tomamae Wind Farm SCADA + LiDAR campaign,01.11.2015,30.11.2017,,10 min,19 Bonus 1 MW + 1 Unison 2 MW (total 20),Hokkaido facing the Japan Sea,,1; 2,Onshore,,No,No
"Al‐Quraan, Ayman; Al‐Masri, Hussein; Al‐Mahmodi, Mohammed; Radaideh, Ashraf; ",Power curve modelling of wind turbines‐A comparison study,IET Renewable Power Generation,16.0,2.0,362-374,2022,Wiley Online Library,power curve estimation,2025-06-12,10.1049/rpg2.12329,"@article{Al_Quraan_2021, title={Power curve modelling of wind turbines‐ A comparison study}, volume={16}, ISSN={1752-1424}, url={http://dx.doi.org/10.1049/rpg2.12329}, DOI={10.1049/rpg2.12329}, number={2}, journal={IET Renewable Power Generation}, publisher={Institution of Engineering and Technology (IET)}, author={Al‐Quraan, Ayman and Al‐Masri, Hussein and Al‐Mahmodi, Mohammed and Radaideh, Ashraf}, year={2021}, month=nov, pages={362–374} }",https://doi.org/10.1049/rpg2.12329,True,True,True,Wind Speed Only,"Piece-wise Polynomial Regression, Piece-wise Exponential Regression, Rayleigh Wind Distribution Model, Ratio Model","RMSE, R^2, Chi-square, RMBE","A database of different commercial HAWT from several
manufacturers has been gathered of around 150 HAWTs",,,,,150,"Manufacturer database – global; case studies – Jordan (Tafila, Hofa, Al Rajef, Daehan)",,,,,On Request,No
