"Wang, Yun; Hu, Qinghua; Srinivasan, Dipti; Wang, Zheng; ",Wind power curve modeling and wind power forecasting with inconsistent data,IEEE Transactions on Sustainable Energy,10.0,1.0,16-25,2018,IEEE,power curve,2025-06-12,10.1109/tste.2018.2820198,"@article{Wang_2019, title={Wind Power Curve Modeling and Wind Power Forecasting With Inconsistent Data}, volume={10}, ISSN={1949-3037}, url={http://dx.doi.org/10.1109/tste.2018.2820198}, DOI={10.1109/tste.2018.2820198}, number={1}, journal={IEEE Transactions on Sustainable Energy}, publisher={Institute of Electrical and Electronics Engineers (IEEE)}, author={Wang, Yun and Hu, Qinghua and Srinivasan, Dipti and Wang, Zheng}, year={2019}, month=jan, pages={16–25} }",https://doi.org/10.1109/tste.2018.2820198,True,True,True,Wind Speed Only,Splines,"RMSE, MAE",,,,,10 min,2,,1,,,,No,No
"Astolfi, Davide; Castellani, Francesco; Terzi, Ludovico; ",Wind turbine power curve upgrades,Energies,11.0,5.0,1300,2018,MDPI,power curve,2025-06-12,10.3390/en11051300,"@article{Astolfi_2018, title={Wind Turbine Power Curve Upgrades}, volume={11}, ISSN={1996-1073}, url={http://dx.doi.org/10.3390/en11051300}, DOI={10.3390/en11051300}, number={5}, journal={Energies}, publisher={MDPI AG}, author={Astolfi, Davide and Castellani, Francesco and Terzi, Ludovico}, year={2018}, month=may, pages={1300} }",https://doi.org/10.3390/en11051300,True,True,True,"Wind Direction, Air Density, Ambient Temperature, Air Pressure, Power of nearby turbines",Feed forward NN,MAE,Collaboration with Renvico srl,01.01.2016,01.04.2018,,10 min,17,Italy and France,,"2,5; 2,3",Onshore,,No,No
"Manobel, Bartolomé; Sehnke, Frank; Lazzús, Juan A; Salfate, Ignacio; Felder, Martin; Montecinos, Sonia; ",Wind turbine power curve modeling based on Gaussian processes and artificial neural networks,Renewable Energy,125.0,,1015-1020,2018,Elsevier,power curve,2025-06-12,10.1016/j.renene.2018.02.081,"@article{Manobel_2018, title={Wind turbine power curve modeling based on Gaussian Processes and Artificial Neural Networks}, volume={125}, ISSN={0960-1481}, url={http://dx.doi.org/10.1016/j.renene.2018.02.081}, DOI={10.1016/j.renene.2018.02.081}, journal={Renewable Energy}, publisher={Elsevier BV}, author={Manobel, Bartolomé and Sehnke, Frank and Lazzús, Juan A. and Salfate, Ignacio and Felder, Martin and Montecinos, Sonia}, year={2018}, month=sep, pages={1015–1020} }",https://doi.org/10.1016/j.renene.2018.02.081,True,True,True,Wind Direction,Feed forward NN,RMSE,,2013,2016,,10 min,3,Coquimbo Region of Chile,2,2,Onshore,,No,No
"Yesilbudak, Mehmet; ",Implementation of novel hybrid approaches for power curve modeling of wind turbines,Energy Conversion and Management,171.0,,156-169,2018,Elsevier,power curve,2025-06-12,10.1016/j.enconman.2018.05.092,"@article{Yesilbudak_2018, title={Implementation of novel hybrid approaches for power curve modeling of wind turbines}, volume={171}, ISSN={0196-8904}, url={http://dx.doi.org/10.1016/j.enconman.2018.05.092}, DOI={10.1016/j.enconman.2018.05.092}, journal={Energy Conversion and Management}, publisher={Elsevier BV}, author={Yesilbudak, Mehmet}, year={2018}, month=sep, pages={156–169} }",https://doi.org/10.1016/j.enconman.2018.05.092,True,True,True,Wind Speed Only,"Polynomial model, Fourier Series Interpolation, Gaussian Model, Sum of Sines, Splines, Piece-wise Linear Regression, Quadratic model, Cubic model, Exponential model, Logarithmic Regression","RMSE, R^2, SSE",Database on Wind Characteristics,,,,10 min,,"Tjæreborg, Denmark",1,2,Onshore,,Yes,No
"Helbing, Georg; Ritter, Matthias; ",Power curve monitoring with flexible EWMA control charts,2017 International Conference on Promising Electronic Technologies (ICPET),,,124-128,2017,IEEE,power curve monitoring,2025-06-12,10.1109/icpet.2017.29,"@inproceedings{Helbing_2017, title={Power Curve Monitoring with Flexible EWMA Control Charts}, url={http://dx.doi.org/10.1109/icpet.2017.29}, DOI={10.1109/icpet.2017.29}, booktitle={2017 International Conference on Promising Electronic Technologies (ICPET)}, publisher={IEEE}, author={Helbing, Georg and Ritter, Matthias}, year={2017}, month=oct }",https://doi.org/10.1109/icpet.2017.29,True,True,True,Wind Speed Only,"EWMA, Autoregressive Model (AR), Splines, Logistic Function",None,Proprietary 10-min SCADA dataset supplied by 4inita GmbH,01.07.2014,31.12.2016,,10 min,1,"Onshore, near the coast in north-west Germany",,,Onshore,356 hours of downtime caused by technical errors,No,No
"Goretti, Gianni; Duffy, Aidan; Lie, Tek Tjing; ",The impact of power curve estimation on commercial wind power forecasts—An empirical analysis,2017 14th International Conference on the European Energy Market (EEM),,,1-4,2017,IEEE,power curve estimation,2025-06-12,10.1109/eem.2017.7981885,"@inproceedings{Goretti_2017, title={The impact of power curve estimation on commercial wind power forecasts — An empirical analysis}, url={http://dx.doi.org/10.1109/eem.2017.7981885}, DOI={10.1109/eem.2017.7981885}, booktitle={2017 14th International Conference on the European Energy Market (EEM)}, publisher={IEEE}, author={Goretti, Gianni and Duffy, Aidan and Lie, Tek Tjing}, year={2017}, month=jun, pages={1–4} }",https://doi.org/10.1109/eem.2017.7981885,True,True,True,Wind Speed Only,IEC Standard,"MAE, RMSE, Mean error",,,,,,,Northern Europe,1,,Onshore,,No,No
"Iversen, Emil B; Morales, Juan M; Møller, Jan K; Trombe, Pierre‐Julien; Madsen, Henrik; ",Leveraging stochastic differential equations for probabilistic forecasting of wind power using a dynamic power curve,Wind Energy,20.0,1.0,33-44,2017,Wiley Online Library,wind power curve,2025-06-12,10.1002/we.1988,"@article{Iversen_2016, title={Leveraging stochastic differential equations for probabilistic forecasting of wind power using a dynamic power curve: Leveraging stochastic differential equations for probabilistic forecasting of wind power using a dynamic power curve}, volume={20}, ISSN={1095-4244}, url={http://dx.doi.org/10.1002/we.1988}, DOI={10.1002/we.1988}, number={1}, journal={Wind Energy}, publisher={Wiley}, author={Iversen, Emil B. and Morales, Juan M. and Møller, Jan K. and Trombe, Pierre-Julien and Madsen, Henrik}, year={2016}, month=may, pages={33–44} }",https://doi.org/10.1002/we.1988,True,True,True,Datetime,SDE,"MAE, RMSE, CRPS, Energy score, SSCRPS",,1/1/1999,31/12/2001,,1h,,"Klim 
Fjordholme, 
Denmark",1,,Onshore,,No,No
"Johansson, Viktor; Thorson, Ludwig; Goop, Joel; Göransson, Lisa; Odenberger, Mikael; Reichenberg, Lina; Taljegard, M; Johnsson, Filip; ",Value of wind power–Implications from specific power,Energy,126.0,,352-360,2017,Elsevier,wind power curve,2025-06-12,10.1016/j.energy.2017.03.038,"@article{Johansson_2017, title={Value of wind power – Implications from specific power}, volume={126}, ISSN={0360-5442}, url={http://dx.doi.org/10.1016/j.energy.2017.03.038}, DOI={10.1016/j.energy.2017.03.038}, journal={Energy}, publisher={Elsevier BV}, author={Johansson, V. and Thorson, L. and Goop, J. and Göransson, L. and Odenberger, M. and Reichenberg, L. and Taljegard, M. and Johnsson, F.}, year={2017}, month=may, pages={352–360} }",https://doi.org/10.1016/j.energy.2017.03.038,True,False,True,,,None,,,,,,,,,,,,,
"Morshedizadeh, Majid; Kordestani, Mojtaba; Carriveau, Rupp; Ting, David SK; Saif, Mehrdad; ",Improved power curve monitoring of wind turbines,Wind engineering,41.0,4.0,260-271,2017,"SAGE Publications Sage UK: London, England",power curve estimation,2025-06-12,10.1177/0309524x17709730,"@article{Morshedizadeh_2017, title={Improved power curve monitoring of wind turbines}, volume={41}, ISSN={2048-402X}, url={http://dx.doi.org/10.1177/0309524x17709730}, DOI={10.1177/0309524x17709730}, number={4}, journal={Wind Engineering}, publisher={SAGE Publications}, author={Morshedizadeh, Majid and Kordestani, Mojtaba and Carriveau, Rupp and Ting, David S-K and Saif, Mehrdad}, year={2017}, month=may, pages={260–271} }",https://doi.org/10.1177/0309524x17709730,False,False,False,,,None,,,,,,,,,,,,,
"Kalmikov, Alexander; ",Wind power fundamentals,Wind energy engineering,,,17-24,2017,Elsevier,wind power curve,2025-06-12,10.1016/b978-0-12-809451-8.00002-3,"@inbook{Kalmikov_2017, title={Wind Power Fundamentals}, ISBN={9780128094518}, url={http://dx.doi.org/10.1016/b978-0-12-809451-8.00002-3}, DOI={10.1016/b978-0-12-809451-8.00002-3}, booktitle={Wind Energy Engineering}, publisher={Elsevier}, author={Kalmikov, Alexander}, year={2017}, pages={17–24} }",https://doi.org/10.1016/b978-0-12-809451-8.00002-3,False,False,False,,,None,,,,,,,,,,,,,
"Tian, Jie; Zhou, Dao; Su, Chi; Soltani, Mohsen; Chen, Zhe; Blaabjerg, Frede; ",Wind turbine power curve design for optimal power generation in wind farms considering wake effect,Energies,10.0,3,395,2017,MDPI,wind energy power curve,2025-06-12,10.3390/en10030395,"@article{Tian_2017, title={Wind Turbine Power Curve Design for Optimal Power Generation in Wind Farms Considering Wake Effect}, volume={10}, ISSN={1996-1073}, url={http://dx.doi.org/10.3390/en10030395}, DOI={10.3390/en10030395}, number={3}, journal={Energies}, publisher={MDPI AG}, author={Tian, Jie and Zhou, Dao and Su, Chi and Soltani, Mohsen and Chen, Zhe and Blaabjerg, Frede}, year={2017}, month=mar, pages={395} }",https://doi.org/10.3390/en10030395,True,False,True,,,None,,,,,,,,,,,,,
"Bardal, Lars Morten; Sætran, Lars Roar; ",Influence of turbulence intensity on wind turbine power curves,Energy Procedia,137.0,,553-558,2017,Elsevier,wind turbine power curve,2025-06-12,10.1016/j.egypro.2017.10.384,"@article{Bardal_2017, title={Influence of turbulence intensity on wind turbine power curves}, volume={137}, ISSN={1876-6102}, url={http://dx.doi.org/10.1016/j.egypro.2017.10.384}, DOI={10.1016/j.egypro.2017.10.384}, journal={Energy Procedia}, publisher={Elsevier BV}, author={Bardal, Lars Morten and Sætran, Lars Roar}, year={2017}, month=oct, pages={553–558} }",https://doi.org/10.1016/j.egypro.2017.10.384,True,True,True,Turbulence Intensity,IEC Standard,RE,,,,10 months,10min,1,Norway,,3,,,No,No
"You, Mingdi; Liu, Bingjie; Byon, Eunshin; Huang, Shuai; Jin, Jionghua; ",Direction-dependent power curve modeling for multiple interacting wind turbines,IEEE Transactions on power systems,33.0,2.0,1725-1733,2017,IEEE,power curve model,2025-06-12,10.1109/tpwrs.2017.2737529,"@article{You_2018, title={Direction-Dependent Power Curve Modeling for Multiple Interacting Wind Turbines}, volume={33}, ISSN={1558-0679}, url={http://dx.doi.org/10.1109/tpwrs.2017.2737529}, DOI={10.1109/tpwrs.2017.2737529}, number={2}, journal={IEEE Transactions on Power Systems}, publisher={Institute of Electrical and Electronics Engineers (IEEE)}, author={You, Mingdi and Liu, Bingjie and Byon, Eunshin and Huang, Shuai and Jin, Jionghua}, year={2018}, month=mar, pages={1725–1733} }",https://doi.org/10.1109/tpwrs.2017.2737529,True,True,True,"Datetime, Wind Direction",Bayesian hierarchical inference,"MAE, RMSE",,,,,10 min,,,3,,,,No,No
"Feijóo, Andrés; Villanueva, Daniel; ",Four-parameter models for wind farm power curves and power probability density functions,IEEE Transactions on Sustainable Energy,8.0,4,1783-1784,2017,IEEE,wind farm power curve,2025-06-12,10.3390/en15010182,"@article{Feij_o_Lorenzo_2021, title={Wind Farm Power Curves and Power Distributions}, volume={15}, ISSN={1996-1073}, url={http://dx.doi.org/10.3390/en15010182}, DOI={10.3390/en15010182}, number={1}, journal={Energies}, publisher={MDPI AG}, author={Feijóo-Lorenzo, Andrés E.}, year={2021}, month=dec, pages={182} }",https://doi.org/10.3390/en15010182,True,False,True,,,None,,,,,,,,,,,,,
"Marčiukaitis, Mantas; Žutautaitė, Inga; Martišauskas, Linas; Jokšas, Benas; Gecevičius, Giedrius; Sfetsos, Athanasios; ",Non-linear regression model for wind turbine power curve,Renewable Energy,113.0,,732-741,2017,Elsevier,power curve,2025-06-12,10.1016/j.renene.2017.06.039,"@article{Mar_iukaitis_2017, title={Non-linear regression model for wind turbine power curve}, volume={113}, ISSN={0960-1481}, url={http://dx.doi.org/10.1016/j.renene.2017.06.039}, DOI={10.1016/j.renene.2017.06.039}, journal={Renewable Energy}, publisher={Elsevier BV}, author={Marčiukaitis, Mantas and Žutautaitė, Inga and Martišauskas, Linas and Jokšas, Benas and Gecevičius, Giedrius and Sfetsos, Athanasios}, year={2017}, month=dec, pages={732–741} }",https://doi.org/10.1016/j.renene.2017.06.039,True,True,True,Wind Direction,"Polynomial regression, Modified hyperbolic tangent function, Exponential model, Mode approach",MAPE,Enercon E8 wind turbines in Seirijai,01.08.2013,31.12.2013,,10 min,3,"Southern Lithuania, on-shore Seirijai wind farm",,2,Onshore,,No,No
"Ouyang, Tinghui; Kusiak, Andrew; He, Yusen; ",Modeling wind-turbine power curve: A data partitioning and mining approach,Renewable Energy,102.0,,1-8,2017,Elsevier,power curve,2025-06-12,10.1016/j.renene.2016.10.032,"@article{Ouyang_2017, title={Modeling wind-turbine power curve: A data partitioning and mining approach}, volume={102}, ISSN={0960-1481}, url={http://dx.doi.org/10.1016/j.renene.2016.10.032}, DOI={10.1016/j.renene.2016.10.032}, journal={Renewable Energy}, publisher={Elsevier BV}, author={Ouyang, Tinghui and Kusiak, Andrew and He, Yusen}, year={2017}, month=mar, pages={1–8} }",https://doi.org/10.1016/j.renene.2016.10.032,True,True,True,Air Density,"Piece-wise Linear Regression, SVR","MAE, RMSE, R^2, MSE, Duration, SSE",,01.06.2014,01.07.2015,,10 min,1,Midwest (USA),,,Onshore,,No,No
"Teyabeen, Alhassan Ali; Akkari, Fathi Rajab; Jwaid, Ali Elseddig; ",Power curve modelling for wind turbines,2017 UKSim-AMSS 19th International Conference on Computer Modelling & Simulation (UKSim),,,179-184,2017,IEEE,power curve,2025-06-12,10.1109/uksim.2017.30,"@inproceedings{Teyabeen_2017, title={Power Curve Modelling for Wind Turbines}, url={http://dx.doi.org/10.1109/uksim.2017.30}, DOI={10.1109/uksim.2017.30}, booktitle={2017 UKSim-AMSS 19th International Conference on Computer Modelling &amp; Simulation (UKSim)}, publisher={IEEE}, author={Teyabeen, Alhassan Ali and Akkari, Fathi Rajab and Jwaid, Ali Elseddig}, year={2017}, month=apr, pages={179–184} }",https://doi.org/10.1109/uksim.2017.30,True,True,True,Wind Speed Only,"Linear model, Polynomial model, Power-coefficient based model, General model, Quadratic model, Exponential model, Cubic model","RE, NRMSE, Correlation coefficient",,,,,,32,,1,various,,,Yes,No
"Zhao, Yongning; Ye, Lin; Wang, Weisheng; Sun, Huadong; Ju, Yuntao; Tang, Yong; ",Data-driven correction approach to refine power curve of wind farm under wind curtailment,IEEE Transactions on Sustainable Energy,9.0,1.0,95-105,2017,IEEE,power curve,2025-06-12,10.1109/tste.2017.2717021,"@article{Zhao_2018, title={Data-Driven Correction Approach to Refine Power Curve of Wind Farm Under Wind Curtailment}, volume={9}, ISSN={1949-3037}, url={http://dx.doi.org/10.1109/tste.2017.2717021}, DOI={10.1109/tste.2017.2717021}, number={1}, journal={IEEE Transactions on Sustainable Energy}, publisher={Institute of Electrical and Electronics Engineers (IEEE)}, author={Zhao, Yongning and Ye, Lin and Wang, Weisheng and Sun, Huadong and Ju, Yuntao and Tang, Yong}, year={2018}, month=jan, pages={95–105} }",https://doi.org/10.1109/tste.2017.2717021,True,True,True,Wind Speed Only,IEC Standard,"NRMSE, Duration",,,,,,20,China,,2,,,No,No
"Cambron, P; Lepvrier, R; Masson, C; Tahan, A; Pelletier, F; ",Power curve monitoring using weighted moving average control charts,Renewable Energy,94.0,,126-135,2016,Elsevier,power curve monitoring,2025-06-12,10.1016/j.renene.2016.03.031,"@article{Cambron_2016, title={Power curve monitoring using weighted moving average control charts}, volume={94}, ISSN={0960-1481}, url={http://dx.doi.org/10.1016/j.renene.2016.03.031}, DOI={10.1016/j.renene.2016.03.031}, journal={Renewable Energy}, publisher={Elsevier BV}, author={Cambron, P. and Lepvrier, R. and Masson, C. and Tahan, A. and Pelletier, F.}, year={2016}, month=aug, pages={126–135} }",https://doi.org/10.1016/j.renene.2016.03.031,True,True,True,"Turbulence Intensity, Air Density","IEC Standard, GWMA, EWMA",None,,01.01.2009,31.12.2015,,10 min,> 50,Canada,,,Onshore,,No,No
"Yesilbudak, Mehmet; ",Partitional clustering-based outlier detection for power curve optimization of wind turbines,2016 IEEE International Conference on Renewable Energy Research and Applications (ICRERA),,,1080-1084,2016,IEEE,power curve monitoring,2025-06-12,10.1109/icrera.2016.7884500,"@inproceedings{Yesilbudak_2016, title={Partitional clustering-based outlier detection for power curve optimization of wind turbines}, url={http://dx.doi.org/10.1109/icrera.2016.7884500}, DOI={10.1109/icrera.2016.7884500}, booktitle={2016 IEEE International Conference on Renewable Energy Research and Applications (ICRERA)}, publisher={IEEE}, author={Yesilbudak, Mehmet}, year={2016}, month=nov }",https://doi.org/10.1109/icrera.2016.7884500,True,False,True,,,None,,,,,,,,,,,,,
"Lou, Jianlou; Shan, Kai; Xu, Jia; ",A new condition monitoring method for wind turbines based on power curve model,International Journal of Control and Automation,121.0,,470-475,2016,,power curve monitoring,2025-06-12,10.14257/astl.2016.121.85,"@inproceedings{Lou_2016, series={AST 2016}, title={A New Condition Monitoring Method for Wind Turbines Based on Power Curve Model}, ISSN={2287-1233}, url={http://dx.doi.org/10.14257/astl.2016.121.85}, DOI={10.14257/astl.2016.121.85}, booktitle={Advanced Science and Technology Letters}, publisher={Science & Engineering Research Support soCiety}, author={Lou, Jianlou and Shan, Kai and Xu, Jia}, year={2016}, month=jan, pages={470–475}, collection={AST 2016} }",https://doi.org/10.14257/astl.2016.121.85,False,False,False,,,None,,,,,,,,,,,,,
"Sohoni, Vaishali; Gupta, Shivcharan; Nema, Rajeshkumar; ",A comparative analysis of wind speed probability distributions for wind power assessment of four sites,Turkish Journal of Electrical Engineering and Computer Sciences,24.0,6.0,4724-4735,2016,,wind power curve,2025-06-12,10.3906/elk-1412-207,"@article{SOHONI_2016, title={A comparative analysis of wind speed probability distributions for wind power assessment of four sites}, volume={24}, ISSN={1303-6203}, url={http://dx.doi.org/10.3906/elk-1412-207}, DOI={10.3906/elk-1412-207}, journal={TURKISH JOURNAL OF ELECTRICAL ENGINEERING &amp; COMPUTER SCIENCES}, publisher={The Scientific and Technological Research Council of Turkey (TUBITAK-ULAKBIM) - DIGITAL COMMONS JOURNALS}, author={SOHONI, Vaishali and GUPTA, Shivcharan and NEMA, Rajeshkumar}, year={2016}, pages={4724–4735} }",https://doi.org/10.3906/elk-1412-207,True,True,True,Air Density,Logistic Function,"RMSE, R^2, Chi-square, Kolmogorov-Smirnov Test, Anderson-Darling Test, Percentage Error","NREL (National Renewable Energy
Laboratory) wind farms; A, B, C and D; Vestas V90",,,1 year,A-C: 10 min; D: 1 hour,10 per wind farm,"Different geographical locations; D: Alberta, Canada",,2,Onshore,,No,No
"Bi, Ran; Zhou, Chengke; Hepburn, Donald M; ",Applying instantaneous SCADA data to artificial intelligence based power curve monitoring and WTG fault forecasting,2016 International Conference on Smart Grid and Clean Energy Technologies (ICSGCE),,,176-181,2016,IEEE,power curve monitoring,2025-06-12,10.1109/icsgce.2016.7876048,"@inproceedings{Bi_2016, title={Applying instantaneous SCADA data to artificial intelligence based power curve monitoring and WTG fault forecasting}, url={http://dx.doi.org/10.1109/icsgce.2016.7876048}, DOI={10.1109/icsgce.2016.7876048}, booktitle={2016 International Conference on Smart Grid and Clean Energy Technologies (ICSGCE)}, publisher={IEEE}, author={Bi, Ran and Zhou, Chengke and Hepburn, Donald M}, year={2016}, month=oct, pages={176–181} }",https://doi.org/10.1109/icsgce.2016.7876048,True,False,True,,,None,,,,,,,,,,,,,
"Lou, Jianlou; Lu, Heng; Xu, Jia; Qu, Zhaoyang; ",A data-mining approach for wind turbine power generation performance monitoring based on power curve,Int. J. Smart Home,10.0,2.0,137-152,2016,,power curve monitoring,2025-06-12,10.14257/astl.2016.121.83,"@inproceedings{Lou_2016, series={AST 2016}, title={A Data-Mining Approach for Wind Turbine Power Generation Performance Monitoring Based on Power Curve}, ISSN={2287-1233}, url={http://dx.doi.org/10.14257/astl.2016.121.83}, DOI={10.14257/astl.2016.121.83}, booktitle={Advanced Science and Technology Letters}, publisher={Science & Engineering Research Support soCiety}, author={Lou, Jianlou and Lu, Heng and Xu, Jia and Qu, Zhaoyang}, year={2016}, month=jan, pages={456–462}, collection={AST 2016} }",https://doi.org/10.14257/astl.2016.121.83,False,False,False,,,None,,,,,,,,,,,,,
"Pelletier, Francis; Masson, Christian; Tahan, Antoine; ",Wind turbine power curve modelling using artificial neural network,Renewable Energy,89.0,,207-214,2016,Elsevier,power curve,2025-06-12,10.1016/j.renene.2015.11.065,"@article{Pelletier_2016, title={Wind turbine power curve modelling using artificial neural network}, volume={89}, ISSN={0960-1481}, url={http://dx.doi.org/10.1016/j.renene.2015.11.065}, DOI={10.1016/j.renene.2015.11.065}, journal={Renewable Energy}, publisher={Elsevier BV}, author={Pelletier, Francis and Masson, Christian and Tahan, Antoine}, year={2016}, month=apr, pages={207–214} }",https://doi.org/10.1016/j.renene.2015.11.065,True,True,True,"Nacelle windspeed, Air Density, Turbulence Intensity, Wind Shear, Wind Direction, Yaw Misalignment","Feed forward NN, Polynomial regression, k-NN, Exponential model, IEC Standard, Logistic Function, Logarithmic Regression","Mean error, MAE",,24-03-2009;01-05-2009,31-01-2010;19-02-2010,,10min,,Nordic/Scandinavia,>50,,,,No,No
"Sohoni, Vaishali; Gupta, SC; Nema, Rajesh K; ",A critical review on wind turbine power curve modelling techniques and their applications in wind based energy systems,Journal of Energy,2016.0,1.0,8519785,2016,Wiley Online Library,power curve,2025-06-12,10.1155/2016/8519785,"@article{Sohoni_2016, title={A Critical Review on Wind Turbine Power Curve Modelling Techniques and Their Applications in Wind Based Energy Systems}, volume={2016}, ISSN={2314-615X}, url={http://dx.doi.org/10.1155/2016/8519785}, DOI={10.1155/2016/8519785}, journal={Journal of Energy}, publisher={Wiley}, author={Sohoni, Vaishali and Gupta, S. C. and Nema, R. K.}, year={2016}, pages={1–18} }",https://doi.org/10.1155/2016/8519785,False,False,True,,,None,,,,,,,,,,,,,
"Bandi, Mahesh M; Apt, Jay; ",Variability of the wind turbine power curve,Applied Sciences,6.0,9.0,262,2016,MDPI,power curve,2025-06-12,10.3390/app6090262,"@article{Bandi_2016, title={Variability of the Wind Turbine Power Curve}, volume={6}, ISSN={2076-3417}, url={http://dx.doi.org/10.3390/app6090262}, DOI={10.3390/app6090262}, number={9}, journal={Applied Sciences}, publisher={MDPI AG}, author={Bandi, Mahesh and Apt, Jay}, year={2016}, month=sep, pages={262} }",https://doi.org/10.3390/app6090262,True,False,True,,,None,,,,,,,,,,,,,
"Xu, Man; Pinson, Pierre; Lu, Zongxiang; Qiao, Ying; Min, Yong; ",Adaptive robust polynomial regression for power curve modeling with application to wind power forecasting,Wind Energy,19.0,12.0,2321-2336,2016,Wiley Online Library,power curve model,2025-06-12,10.1002/we.1985,"@article{Xu_2016, title={Adaptive robust polynomial regression for power curve modeling with application to wind power forecasting}, volume={19}, ISSN={1099-1824}, url={http://dx.doi.org/10.1002/we.1985}, DOI={10.1002/we.1985}, number={12}, journal={Wind Energy}, publisher={Wiley}, author={Xu, Man and Pinson, Pierre and Lu, Zongxiang and Qiao, Ying and Min, Yong}, year={2016}, month=apr, pages={2321–2336} }",https://doi.org/10.1002/we.1985,True,True,True,Wind Speed Only,Polynomial regression,"RMSE, Mean error, MAE",,,,1 year,1h,32,Western China,,,Onshore,,No,No
"Wang, Shuangyuan; Huang, Yixiang; Li, Lin; Liu, Chengliang; ",Wind turbines abnormality detection through analysis of wind farm power curves,Measurement,93.0,,178-188,2016,Elsevier,wind farm power curve,2025-06-12,10.1016/j.measurement.2016.07.006,"@article{Wang_2016, title={Wind turbines abnormality detection through analysis of wind farm power curves}, volume={93}, ISSN={0263-2241}, url={http://dx.doi.org/10.1016/j.measurement.2016.07.006}, DOI={10.1016/j.measurement.2016.07.006}, journal={Measurement}, publisher={Elsevier BV}, author={Wang, Shuangyuan and Huang, Yixiang and Li, Lin and Liu, Chengliang}, year={2016}, month=nov, pages={178–188} }",https://doi.org/10.1016/j.measurement.2016.07.006,True,False,True,,,None,,,,,,,,,,,,,
"Taslimi-Renani, Ehsan; Modiri-Delshad, Mostafa; Elias, Mohamad Fathi Mohamad; Rahim, Nasrudin Abd; ",Development of an enhanced parametric model for wind turbine power curve,Applied energy,177.0,,544-552,2016,Elsevier,power curve,2025-06-12,10.1016/j.apenergy.2016.05.124,"@article{Taslimi_Renani_2016, title={Development of an enhanced parametric model for wind turbine power curve}, volume={177}, ISSN={0306-2619}, url={http://dx.doi.org/10.1016/j.apenergy.2016.05.124}, DOI={10.1016/j.apenergy.2016.05.124}, journal={Applied Energy}, publisher={Elsevier BV}, author={Taslimi-Renani, Ehsan and Modiri-Delshad, Mostafa and Elias, Mohamad Fathi Mohamad and Rahim, Nasrudin Abd.}, year={2016}, month=sep, pages={544–552} }",https://doi.org/10.1016/j.apenergy.2016.05.124,True,True,True,Wind Speed Only,Modified hyperbolic tangent function,"RMSE, MAPE",,9/4/2013,4/3/2014,,5 min,1,"Khorasan, Iran",,1.5,Onshore,,No,No
