"Yu, Guangzheng; Liu, Chengquan; Tang, Bo; Chen, Rusi; Lu, Liu; Cui, Chaoyue; Hu, Yue; Shen, Lingxu; Muyeen, SM; ",Short term wind power prediction for regional wind farms based on spatial-temporal characteristic distribution,Renewable Energy,199.0,,599-612,2022,Elsevier,wind power curve,2025-06-12,10.1016/j.renene.2022.08.142,"@article{Yu_2022, title={Short term wind power prediction for regional wind farms based on spatial-temporal characteristic distribution}, volume={199}, ISSN={0960-1481}, url={http://dx.doi.org/10.1016/j.renene.2022.08.142}, DOI={10.1016/j.renene.2022.08.142}, journal={Renewable Energy}, publisher={Elsevier BV}, author={Yu, Guangzheng and Liu, Chengquan and Tang, Bo and Chen, Rusi and Lu, Liu and Cui, Chaoyue and Hu, Yue and Shen, Lingxu and Muyeen, S.M.}, year={2022}, month=nov, pages={599–612} }",https://doi.org/10.1016/j.renene.2022.08.142,True,False,True,,,None,,,,,,,,,,,,,
"Bilendo, Francisco; Meyer, Angela; Badihi, Hamed; Lu, Ningyun; Cambron, Philippe; Jiang, Bin; ",Applications and modeling techniques of wind turbine power curve for wind farms—A review,Energies,16.0,1.0,180,2022,MDPI,power curve,2025-06-12,10.3390/en16010180,"@article{Bilendo_2022, title={Applications and Modeling Techniques of Wind Turbine Power Curve for Wind Farms—A Review}, volume={16}, ISSN={1996-1073}, url={http://dx.doi.org/10.3390/en16010180}, DOI={10.3390/en16010180}, number={1}, journal={Energies}, publisher={MDPI AG}, author={Bilendo, Francisco and Meyer, Angela and Badihi, Hamed and Lu, Ningyun and Cambron, Philippe and Jiang, Bin}, year={2022}, month=dec, pages={180} }",https://doi.org/10.3390/en16010180,False,False,True,,,None,,,,,,,,,,,,,
"Morrison, Rory; Liu, Xiaolei; Lin, Zi; ",Anomaly detection in wind turbine SCADA data for power curve cleaning,Renewable Energy,184.0,,473-486,2022,Elsevier,power curve,2025-06-12,10.1016/j.renene.2021.11.118,"@article{Morrison_2022, title={Anomaly detection in wind turbine SCADA data for power curve cleaning}, volume={184}, ISSN={0960-1481}, url={http://dx.doi.org/10.1016/j.renene.2021.11.118}, DOI={10.1016/j.renene.2021.11.118}, journal={Renewable Energy}, publisher={Elsevier BV}, author={Morrison, Rory and Liu, Xiaolei and Lin, Zi}, year={2022}, month=jan, pages={473–486} }",https://doi.org/10.1016/j.renene.2021.11.118,True,False,True,,,None,,,,,,,,,,,,,
"Pandit, Ravi; Infield, David; Santos, Matilde; ",Accounting for environmental conditions in data-driven wind turbine power models,IEEE Transactions on Sustainable Energy,14.0,1.0,168-177,2022,IEEE,wind turbine power,2025-06-13,10.1109/tste.2022.3204453,"@article{Pandit_2023, title={Accounting for Environmental Conditions in Data-Driven Wind Turbine Power Models}, volume={14}, ISSN={1949-3037}, url={http://dx.doi.org/10.1109/tste.2022.3204453}, DOI={10.1109/tste.2022.3204453}, number={1}, journal={IEEE Transactions on Sustainable Energy}, publisher={Institute of Electrical and Electronics Engineers (IEEE)}, author={Pandit, Ravi and Infield, David and Santos, Matilde}, year={2023}, month=jan, pages={168–177} }",https://doi.org/10.1109/tste.2022.3204453,True,True,True,"Turbulence Intensity, Wind Shear, Yaw Misalignment, Air Density",Gaussian Process,"R^2, RMSE, MAE",2.3 MW Siemens (SWT-2.3-108) variable pitch controlled wind turbine that is currently in operation and owned by ScottishPower Renewables,01.03.2012,30.05.2012,,10 min,1,"Glasgow, Scotland",,"2,5",Onshore,,No,No
"Astolfi, Davide; Castellani, Francesco; Lombardi, Andrea; Terzi, Ludovico; ",Multivariate SCADA data analysis methods for real-world wind turbine power curve monitoring,Energies,14.0,4.0,1105,2021,MDPI,power curve monitoring,2025-06-12,10.3390/en14041105,"@article{Astolfi_2021, title={Multivariate SCADA Data Analysis Methods for Real-World Wind Turbine Power Curve Monitoring}, volume={14}, ISSN={1996-1073}, url={http://dx.doi.org/10.3390/en14041105}, DOI={10.3390/en14041105}, number={4}, journal={Energies}, publisher={MDPI AG}, author={Astolfi, Davide and Castellani, Francesco and Lombardi, Andrea and Terzi, Ludovico}, year={2021}, month=feb, pages={1105} }",https://doi.org/10.3390/en14041105,True,True,True,"Blade Pitch Angle, Rotor RPM, Generator speed",SVR,"MAE, MAPE, RMSE, Residuals","Senvion MM92, Vestas V90, Vestas V117",2017/2019,2018/2020,2 years,10 min,3,Italy,6,2/3.45,Onshore,no mention,No,No
"Yun, Eunjeong; Hur, Jin; ",Probabilistic estimation model of power curve to enhance power output forecasting of wind generating resources,Energy,223.0,,120000,2021,Elsevier,power curve estimation,2025-06-12,10.1016/j.energy.2021.120000,"@article{Yun_2021, title={Probabilistic estimation model of power curve to enhance power output forecasting of wind generating resources}, volume={223}, ISSN={0360-5442}, url={http://dx.doi.org/10.1016/j.energy.2021.120000}, DOI={10.1016/j.energy.2021.120000}, journal={Energy}, publisher={Elsevier BV}, author={Yun, Eunjeong and Hur, Jin}, year={2021}, month=may, pages={120000} }",https://doi.org/10.1016/j.energy.2021.120000,True,True,True,Wind Speed Only,MCS,"NMAE, NRMSE",,,,summer and winter 2016,,,"Jeju Island, South Korea",,,,,No,No
"Cascianelli, Silvia; Astolfi, Davide; Castellani, Francesco; Cucchiara, Rita; Fravolini, Mario Luca; ",Wind turbine power curve monitoring based on environmental and operational data,IEEE Transactions on Industrial Informatics,18.0,8.0,5209-5218,2021,IEEE,power curve estimation,2025-06-12,10.1109/tii.2021.3128205,"@article{Cascianelli_2022, title={Wind Turbine Power Curve Monitoring Based on Environmental and Operational Data}, volume={18}, ISSN={1941-0050}, url={http://dx.doi.org/10.1109/tii.2021.3128205}, DOI={10.1109/tii.2021.3128205}, number={8}, journal={IEEE Transactions on Industrial Informatics}, publisher={Institute of Electrical and Electronics Engineers (IEEE)}, author={Cascianelli, Silvia and Astolfi, Davide and Castellani, Francesco and Cucchiara, Rita and Fravolini, Mario Luca}, year={2022}, month=aug, pages={5209–5218} }",https://doi.org/10.1109/tii.2021.3128205,True,True,True,"Turbulence Intensity, Ambient Temperature, Nacelle Orientation, Rotor RPM, Generator speed, Blade Pitch Angle, yaw angle, Component Temperature(s)",Polynomial regression,MAE,,,,,10min,,,,,,,No,No
"Eminoglu, Ulas; Turksoy, Omer; ",Power curve modeling for wind turbine systems: A comparison study,International Journal of Ambient Energy,42.0,16.0,1912-1921,2021,Taylor & Francis,power curve estimation,2025-06-12,10.1080/01430750.2019.1630302,"@article{Eminoglu_2019, title={Power curve modeling for wind turbine systems: a comparison study}, volume={42}, ISSN={2162-8246}, url={http://dx.doi.org/10.1080/01430750.2019.1630302}, DOI={10.1080/01430750.2019.1630302}, number={16}, journal={International Journal of Ambient Energy}, publisher={Informa UK Limited}, author={Eminoglu, Ulas and Turksoy, Omer}, year={2019}, month=jun, pages={1912–1921} }",https://doi.org/10.1080/01430750.2019.1630302,False,False,False,,,None,,,,,,,,,,,,,
"Yang, Mao; Shi, Chaoyu; Liu, Huiyu; ",Day-ahead wind power forecasting based on the clustering of equivalent power curves,Energy,218.0,,119515,2021,Elsevier,wind power curve,2025-06-12,10.1016/j.energy.2020.119515,"@article{Yang_2021, title={Day-ahead wind power forecasting based on the clustering of equivalent power curves}, volume={218}, ISSN={0360-5442}, url={http://dx.doi.org/10.1016/j.energy.2020.119515}, DOI={10.1016/j.energy.2020.119515}, journal={Energy}, publisher={Elsevier BV}, author={Yang, Mao and Shi, Chaoyu and Liu, Huiyu}, year={2021}, month=mar, pages={119515} }",https://doi.org/10.1016/j.energy.2020.119515,True,True,True,Wind Speed Only,Polynomial regression,"RMSE, MAE",,01-08-2013,30-09-2013,,15min,35,northeast China,,1.5MW,,,No,No
"Jing, Bo; Qian, Zheng; Zareipour, Hamidreza; Pei, Yan; Wang, Anqi; ",Wind turbine power curve modelling with logistic functions based on quantile regression,Applied Sciences,11.0,7.0,3048.0,2021,MDPI,power curve modeling,2025-06-12,10.3390/app11073048,"@article{Jing_2021, title={Wind Turbine Power Curve Modelling with Logistic Functions Based on Quantile Regression}, volume={11}, ISSN={2076-3417}, url={http://dx.doi.org/10.3390/app11073048}, DOI={10.3390/app11073048}, number={7}, journal={Applied Sciences}, publisher={MDPI AG}, author={Jing, Bo and Qian, Zheng and Zareipour, Hamidreza and Pei, Yan and Wang, Anqi}, year={2021}, month=mar, pages={3048} }",https://doi.org/10.3390/app11073048,True,True,True,"Rotor RPM, Blade Pitch Angle",Quantile Regression,"MAPE, NRMSE, PICP, PINAW",,"(1) 01-01-2017
(2) 01-03-2018
(3) 01-07-2018","(1) 31-03-2017
(2) 31-05-2018
(3) 30-09-2018",,10min,,"(1) Hunan, China
(2) Yunnan province, China
(3) Jiangsu province, China",,"(1) 2MW
(2) 2MW
(3) 5MW",Beides,,,No
"Zou, Runmin; Yang, Jiaxin; Wang, Yun; Liu, Fang; Essaaidi, Mohamed; Srinivasan, Dipti; ",Wind turbine power curve modeling using an asymmetric error characteristic-based loss function and a hybrid intelligent optimizer,Applied Energy,304.0,,117707,2021,Elsevier,power curve model,2025-06-12,10.1016/j.apenergy.2021.117707,"@article{Zou_2021, title={Wind turbine power curve modeling using an asymmetric error characteristic-based loss function and a hybrid intelligent optimizer}, volume={304}, ISSN={0306-2619}, url={http://dx.doi.org/10.1016/j.apenergy.2021.117707}, DOI={10.1016/j.apenergy.2021.117707}, journal={Applied Energy}, publisher={Elsevier BV}, author={Zou, Runmin and Yang, Jiaxin and Wang, Yun and Liu, Fang and Essaaidi, Mohamed and Srinivasan, Dipti}, year={2021}, month=dec, pages={117707} }",https://doi.org/10.1016/j.apenergy.2021.117707,True,True,True,Wind Speed Only,"Logistic Function, Modified hyperbolic tangent function","MAE, RMSE, R^2",,,,,,,"(1) Xichang, China
(2) Hunan, China
(3) China inner Mongolia
(4) China inner Mongolia",,,,,No,No
"Wei, Danxiang; Wang, Jianzhou; Li, Zhiwu; Wang, Rui; ",Wind power curve modeling with hybrid copula and grey wolf optimization,IEEE Transactions on Sustainable Energy,13.0,1.0,265-276,2021,IEEE,power curve model,2025-06-12,10.1109/tste.2021.3109044,"@article{Wei_2022, title={Wind Power Curve Modeling With Hybrid Copula and Grey Wolf Optimization}, volume={13}, ISSN={1949-3037}, url={http://dx.doi.org/10.1109/tste.2021.3109044}, DOI={10.1109/tste.2021.3109044}, number={1}, journal={IEEE Transactions on Sustainable Energy}, publisher={Institute of Electrical and Electronics Engineers (IEEE)}, author={Wei, Danxiang and Wang, Jianzhou and Li, Zhiwu and Wang, Rui}, year={2022}, month=jan, pages={265–276} }",https://doi.org/10.1109/tste.2021.3109044,True,True,True,Wind Speed Only,HCCM,"R^2, RMSE, MAE","WF1, WF2, WF3, WF4, WT1, WT2",01/05/2018,03/09/2018,,10 min,4+6+6+4+1+1,"Lishui, Zhejiang province, China/Turkey",1,,Onshore,,No,No
"Astolfi, Davide; ",Perspectives on scada data analysis methods for multivariate wind turbine power curve modeling,Machines,9.0,5.0,100,2021,MDPI,power curve model,2025-06-12,10.3390/machines9050100,"@article{Astolfi_2021, title={Perspectives on SCADA Data Analysis Methods for Multivariate Wind Turbine Power Curve Modeling}, volume={9}, ISSN={2075-1702}, url={http://dx.doi.org/10.3390/machines9050100}, DOI={10.3390/machines9050100}, number={5}, journal={Machines}, publisher={MDPI AG}, author={Astolfi, Davide}, year={2021}, month=may, pages={100} }",https://doi.org/10.3390/machines9050100,True,True,True,"Blade Pitch Angle, Generator speed, Rotor RPM",SVR,"Residuals, MAE, RMSE, NMAE, NRMSE",Two-year SCADA dataset from an ENGIE Italia industrial wind farm,,,two years,10 min,1,Italy,150,2,,,No,No
"Astolfi, Davide; Pandit, Ravi; ",Multivariate wind turbine power curve model based on data clustering and polynomial LASSO regression,Applied Sciences,12.0,1.0,72,2021,MDPI,power curve model,2025-06-12,10.3390/app12010072,"@article{Astolfi_2021, title={Multivariate Wind Turbine Power Curve Model Based on Data Clustering and Polynomial LASSO Regression}, volume={12}, ISSN={2076-3417}, url={http://dx.doi.org/10.3390/app12010072}, DOI={10.3390/app12010072}, number={1}, journal={Applied Sciences}, publisher={MDPI AG}, author={Astolfi, Davide and Pandit, Ravi}, year={2021}, month=dec, pages={72} }",https://doi.org/10.3390/app12010072,True,True,True,"Blade Pitch Angle, Rotor RPM, Air Density, Ambient Temperature","LASSO, SVR, Gaussian Process","Residuals, MAE, MAPE, RMSE",Lucky Wind s.p.a.,01.01.2019,31.12.2020,,,1 Vestas V52,Southern Italy,5,"0,85",,,No,No
"Mehrjoo, Mehrdad; Jozani, Mohammad Jafari; Pawlak, Miroslaw; Bagen, Bagen; ",A multilevel modeling approach towards wind farm aggregated power curve,IEEE Transactions on Sustainable Energy,12.0,4,2230-2237,2021,IEEE,wind farm power curve,2025-06-12,10.1109/tste.2021.3087018,"@article{Mehrjoo_2021, title={A Multilevel Modeling Approach Towards Wind Farm Aggregated Power Curve}, volume={12}, ISSN={1949-3037}, url={http://dx.doi.org/10.1109/tste.2021.3087018}, DOI={10.1109/tste.2021.3087018}, number={4}, journal={IEEE Transactions on Sustainable Energy}, publisher={Institute of Electrical and Electronics Engineers (IEEE)}, author={Mehrjoo, Mehrdad and Jozani, Mohammad Jafari and Pawlak, Miroslaw and Bagen, Bagen}, year={2021}, month=oct, pages={2230–2237} }",https://doi.org/10.1109/tste.2021.3087018,True,True,True,Wind Speed Only,Splines,"MAE, RMSE",,1/6/2006,31/1/2007,,10 min,63,Canada,1,1.7,Onshore,,No,No
"Feijóo-Lorenzo, Andrés E; ",Wind Farm Power Curves and Power Distributions,Energies,15.0,1,182,2021,MDPI,wind farm power curve,2025-06-12,10.3390/en15010182,"@article{Feij_o_Lorenzo_2021, title={Wind Farm Power Curves and Power Distributions}, volume={15}, ISSN={1996-1073}, url={http://dx.doi.org/10.3390/en15010182}, DOI={10.3390/en15010182}, number={1}, journal={Energies}, publisher={MDPI AG}, author={Feijóo-Lorenzo, Andrés E.}, year={2021}, month=dec, pages={182} }",https://doi.org/10.3390/en15010182,True,False,True,,,None,,,,,,,,,,,,,
"Karamichailidou, Despina; Kaloutsa, Vasiliki; Alexandridis, Alex; ",Wind turbine power curve modeling using radial basis function neural networks and tabu search,Renewable Energy,163.0,,2137-2152,2021,Elsevier,power curve,2025-06-12,10.1016/j.renene.2020.10.020,"@article{Karamichailidou_2021, title={Wind turbine power curve modeling using radial basis function neural networks and tabu search}, volume={163}, ISSN={0960-1481}, url={http://dx.doi.org/10.1016/j.renene.2020.10.020}, DOI={10.1016/j.renene.2020.10.020}, journal={Renewable Energy}, publisher={Elsevier BV}, author={Karamichailidou, Despina and Kaloutsa, Vasiliki and Alexandridis, Alex}, year={2021}, month=jan, pages={2137–2152} }",https://doi.org/10.1016/j.renene.2020.10.020,True,True,True,"Ambient Temperature, Blade Pitch Angle, Wind Direction",RBFNN,MAE,,,,1 year,10 min,4,,,,,,No,No
"Xu, Keyi; Yan, Jie; Zhang, Hao; Zhang, Haoran; Han, Shuang; Liu, Yongqian; ",Quantile based probabilistic wind turbine power curve model,Applied Energy,296.0,,116913,2021,Elsevier,power curve,2025-06-12,10.46855/energy-proceedings-7399,"@article{Xu_2021, title={Quantile based probabilistic wind turbine power curve model}, url={http://dx.doi.org/10.46855/energy-proceedings-7399}, DOI={10.46855/energy-proceedings-7399}, publisher={Applied Energy Innovation Institute (AEii)}, author={Xu, Keyi and Yan, Jie and Zhang, Hao and Zhang, Zhaoran and Han, Shuang and Liu, Yongqian}, year={2021}, month=mar }",https://doi.org/10.46855/energy-proceedings-7399,True,True,True,Blade Pitch Angle,"NN with Quantile Loss, IEC Standard",None,Chinese Wind Farm,,,1 year,1 min,3,China,,,,,No,No
"Gao, Linyue; Li, Bochen; Hong, Jiarong; ",Effect of wind veer on wind turbine power generation,Physics of Fluids,33.0,1.0,,2021,AIP Publishing,wind turbine power,2025-06-13,10.1063/5.0033826,"@article{Gao_2021, title={Effect of wind veer on wind turbine power generation}, volume={33}, ISSN={1089-7666}, url={http://dx.doi.org/10.1063/5.0033826}, DOI={10.1063/5.0033826}, number={1}, journal={Physics of Fluids}, publisher={AIP Publishing}, author={Gao, Linyue and Li, Bochen and Hong, Jiarong}, year={2021}, month=jan }",https://doi.org/10.1063/5.0033826,True,False,True,,,None,,,,5 years,2min,1,"Rosemount, Minnesota, USA",,2.5MW,Onshore,,On Request,No
"Pandit, Ravi Kumar; Infield, David; Kolios, Athanasios; ",Gaussian process power curve models incorporating wind turbine operational variables,Energy Reports,6.0,,1658-1669,2020,Elsevier,power curve estimation,2025-06-12,10.1016/j.egyr.2020.06.018,"@article{Pandit_2020, title={Gaussian process power curve models incorporating wind turbine operational variables}, volume={6}, ISSN={2352-4847}, url={http://dx.doi.org/10.1016/j.egyr.2020.06.018}, DOI={10.1016/j.egyr.2020.06.018}, journal={Energy Reports}, publisher={Elsevier BV}, author={Pandit, Ravi Kumar and Infield, David and Kolios, Athanasios}, year={2020}, month=nov, pages={1658–1669} }",https://doi.org/10.1016/j.egyr.2020.06.018,True,True,True,"Blade Pitch Angle, Rotor RPM, Air Pressure, Air Density","Gaussian Process, IEC Standard","MAE, RMSE, R^2, Residuals",,01.07.2012,31.12.2012,,10,Multiple,"Scotland, UK",> 100,"2,3",Onshore,,No,No
"Helbing, Georg; Ritter, Matthias; ",Improving wind turbine power curve monitoring with standardisation,Renewable energy,145.0,,1040-1048,2020,Elsevier,power curve monitoring,2025-06-12,10.1016/j.renene.2019.06.112,"@article{Helbing_2020, title={Improving wind turbine power curve monitoring with standardisation}, volume={145}, ISSN={0960-1481}, url={http://dx.doi.org/10.1016/j.renene.2019.06.112}, DOI={10.1016/j.renene.2019.06.112}, journal={Renewable Energy}, publisher={Elsevier BV}, author={Helbing, Georg and Ritter, Matthias}, year={2020}, month=jan, pages={1040–1048} }",https://doi.org/10.1016/j.renene.2019.06.112,True,True,True,Wind Speed Only,"Logistic Function, MCS, Linear model",None,,,,1 year,1sec,,"North Sea, Germany",,,Offshore,,No,No
"Hu, Yang; Xi, Yunhua; Pan, Chenyang; Li, Gengda; Chen, Baowei; ",Daily condition monitoring of grid-connected wind turbine via high-fidelity power curve and its comprehensive rating,Renewable Energy,146.0,,2095-2111,2020,Elsevier,power curve monitoring,2025-06-12,10.1016/j.renene.2019.08.043,"@article{Hu_2020, title={Daily condition monitoring of grid-connected wind turbine via high-fidelity power curve and its comprehensive rating}, volume={146}, ISSN={0960-1481}, url={http://dx.doi.org/10.1016/j.renene.2019.08.043}, DOI={10.1016/j.renene.2019.08.043}, journal={Renewable Energy}, publisher={Elsevier BV}, author={Hu, Yang and Xi, Yunhua and Pan, Chenyang and Li, Gengda and Chen, Baowei}, year={2020}, month=feb, pages={2095–2111} }",https://doi.org/10.1016/j.renene.2019.08.043,True,True,True,Wind Speed Only,"Conditional Kernel Density Estimation, Gaussian Process, SVR, Logistic Function","MREICP, MREACE, REIAW, RMSE",,01-01-2018,30-04-2018,,,,,,,,,No,No
"Pandit, Ravi; Kolios, Athanasios; ",SCADA data-based support vector machine wind turbine power curve uncertainty estimation and its comparative studies,Applied Sciences,10.0,23.0,8685,2020,MDPI,power curve estimation,2025-06-12,10.3390/app10238685,"@article{Pandit_2020, title={SCADA Data-Based Support Vector Machine Wind Turbine Power Curve Uncertainty Estimation and Its Comparative Studies}, volume={10}, ISSN={2076-3417}, url={http://dx.doi.org/10.3390/app10238685}, DOI={10.3390/app10238685}, number={23}, journal={Applied Sciences}, publisher={MDPI AG}, author={Pandit, Ravi and Kolios, Athanasios}, year={2020}, month=dec, pages={8685} }",https://doi.org/10.3390/app10238685,True,True,True,Wind Speed Only,SVR,"R^2, RMSE, MAE",,01-09-2012,30-11-2012,,10min,215,"Glasgow, Scotland, UK",,,Onshore,,,
"Saint-Drenan, Yves-Marie; Besseau, Romain; Jansen, Malte; Staffell, Iain; Troccoli, Alberto; Dubus, Laurent; Schmidt, Johannes; Gruber, Katharina; Simões, Sofia G; Heier, Siegfried; ",A parametric model for wind turbine power curves incorporating environmental conditions,Renewable Energy,157.0,,754-768,2020,Elsevier,wind energy power curve,2025-06-12,10.1016/j.renene.2020.04.123,"@article{Saint_Drenan_2020, title={A parametric model for wind turbine power curves incorporating environmental conditions}, volume={157}, ISSN={0960-1481}, url={http://dx.doi.org/10.1016/j.renene.2020.04.123}, DOI={10.1016/j.renene.2020.04.123}, journal={Renewable Energy}, publisher={Elsevier BV}, author={Saint-Drenan, Yves-Marie and Besseau, Romain and Jansen, Malte and Staffell, Iain and Troccoli, Alberto and Dubus, Laurent and Schmidt, Johannes and Gruber, Katharina and Simões, Sofia G. and Heier, Siegfried}, year={2020}, month=sep, pages={754–768} }",https://doi.org/10.1016/j.renene.2020.04.123,True,True,True,"power density, cut-in speed, cut-out speed, Rotor RPM, aerodynamic efficiency, Turbulence Intensity, Air Density, Wind Shear, wind veer, wake effect, inflow angle",Power-coefficient based model,None,https://www.thewindpower.net/,,,,,91,,,>1MW,,,Yes,Yes
"Rogers, TJ; Gardner, P; Dervilis, N; Worden, K; Maguire, AE; Papatheou, E; Cross, EJ; ",Probabilistic modelling of wind turbine power curves with application of heteroscedastic Gaussian process regression,Renewable Energy,148.0,,1124-1136,2020,Elsevier,wind turbine power curve,2025-06-12,10.1016/j.renene.2019.09.145,"@article{Rogers_2020, title={Probabilistic modelling of wind turbine power curves with application of heteroscedastic Gaussian Process regression}, volume={148}, ISSN={0960-1481}, url={http://dx.doi.org/10.1016/j.renene.2019.09.145}, DOI={10.1016/j.renene.2019.09.145}, journal={Renewable Energy}, publisher={Elsevier BV}, author={Rogers, T.J. and Gardner, P. and Dervilis, N. and Worden, K. and Maguire, A.E. and Papatheou, E. and Cross, E.J.}, year={2020}, month=apr, pages={1124–1136} }",https://doi.org/10.1016/j.renene.2019.09.145,True,True,True,Wind Speed Only,Gaussian Process,NMSE,,,,125 weeks,10min,1,,,,,,No,No
"Mehrjoo, Mehrdad; Jozani, Mohammad Jafari; Pawlak, Miroslaw; ",Wind turbine power curve modeling for reliable power prediction using monotonic regression,Renewable Energy,147.0,,214-222,2020,Elsevier,power curve,2025-06-12,10.1016/j.renene.2019.08.060,"@article{Mehrjoo_2020, title={Wind turbine power curve modeling for reliable power prediction using monotonic regression}, volume={147}, ISSN={0960-1481}, url={http://dx.doi.org/10.1016/j.renene.2019.08.060}, DOI={10.1016/j.renene.2019.08.060}, journal={Renewable Energy}, publisher={Elsevier BV}, author={Mehrjoo, Mehrdad and Jafari Jozani, Mohammad and Pawlak, Miroslaw}, year={2020}, month=mar, pages={214–222} }",https://doi.org/10.1016/j.renene.2019.08.060,True,True,True,Wind Speed Only,"Piece-wise Polynomial Regression, Conditional Kernel Density Estimation","RMSE, NMAPE",,01-06-2006,01-01-2007,,10min; 1h,,"Manitoba, Canada",,,,,No,No
"Shetty, Rashmi P; Sathyabhama, A; Pai, P Srinivasa; ",Comparison of modeling methods for wind power prediction: a critical study,Frontiers in Energy,14.0,2.0,347-358,2020,Springer,wind power curve,2025-06-12,10.1007/s11708-018-0553-3,"@article{Shetty_2018, title={Comparison of modeling methods for wind power prediction: a critical study}, volume={14}, ISSN={2095-1698}, url={http://dx.doi.org/10.1007/s11708-018-0553-3}, DOI={10.1007/s11708-018-0553-3}, number={2}, journal={Frontiers in Energy}, publisher={Springer Science and Business Media LLC}, author={Shetty, Rashmi P. and Sathyabhama, A. and Pai, P. Srinivasa}, year={2018}, month=apr, pages={347–358} }",https://doi.org/10.1007/s11708-018-0553-3,True,True,True,"Blade Pitch Angle, Air Density, Rotor RPM, Wind Direction","ANN, RSM, Piece-wise Linear Regression, Piece-wise Polynomial Regression, Splines, MLP",RMSE,,01.06.2013,30.11.2013,,1 hour,1,India,5,"1,5",,,No,No
"Lee, Joseph CY; Stuart, Peter; Clifton, Andrew; Fields, M Jason; Perr-Sauer, Jordan; Williams, Lindy; Cameron, Lee; Geer, Taylor; Housley, Paul; ",The Power Curve Working Group's assessment of wind turbine power performance prediction methods,Wind Energy Science,5.0,1,199-223,2020,"Copernicus Publications Göttingen, Germany",wind energy power curve,2025-06-12,10.5194/wes-2019-69,"@article{Lee_2019, title={The Power Curve Working Group’s Assessment of Wind Turbine
Power Performance Prediction Methods}, url={http://dx.doi.org/10.5194/wes-2019-69}, DOI={10.5194/wes-2019-69}, publisher={Copernicus GmbH}, author={Lee, Joseph C. Y. and Stuart, Peter and Clifton, Andrew and Fields, M. Jason and Perr-Sauer, Jordan and Williams, Lindy and Cameron, Lee and Geer, Taylor and Housley, Paul}, year={2019}, month=oct }",https://doi.org/10.5194/wes-2019-69,True,True,True,"Ambient Temperature, Air Pressure, Air Density, Wind Shear, Turbulence Intensity, Datetime, Wind Direction","IEC Standard, piecewise cubic Hermite interpolating polynomial","MAE, Mean error",Share-3 exercise data from Power Curve Working Group (PCWG),01.01.2011,31.12.2018,,10 min,55,,,,,,No,Yes
"Wang, Yun; Li, Yifen; Zou, Runmin; Foley, Aoife M; Al Kez, Dlzar; Song, Dongran; Hu, Qinghua; Srinivasan, Dipti; ",Sparse heteroscedastic multiple spline regression models for wind turbine power curve modeling,IEEE Transactions on Sustainable Energy,12.0,1.0,191-201,2020,IEEE,power curve model,2025-06-12,10.1109/tste.2020.2988683,"@article{Wang_2021, title={Sparse Heteroscedastic Multiple Spline Regression Models for Wind Turbine Power Curve Modeling}, volume={12}, ISSN={1949-3037}, url={http://dx.doi.org/10.1109/tste.2020.2988683}, DOI={10.1109/tste.2020.2988683}, number={1}, journal={IEEE Transactions on Sustainable Energy}, publisher={Institute of Electrical and Electronics Engineers (IEEE)}, author={Wang, Yun and Li, Yifen and Zou, Runmin and Foley, Aoife M. and Al Kez, Dlzar and Song, Dongran and Hu, Qinghua and Srinivasan, Dipti}, year={2021}, month=jan, pages={191–201} }",https://doi.org/10.1109/tste.2020.2988683,True,True,True,Wind Speed Only,SHMSRM,"MAE, RMSE, NMAPE",,,,,10 min,3,China,1,,Onshore,,No,No
